"Detect Similar Mobile Applications with Transfer Learning","N. Bu; L. Yu; W. Ma; C. Du; S. Niu; G. Long","Institute of Software, Chinese Academy of Sciences; Institute of Software, Chinese Academy of Sciences; Institute of Software, Chinese Academy of Sciences; Institute of Software, Chinese Academy of Sciences; Institute of Software, Chinese Academy of Sciences; Institute of Software, Chinese Academy of Sciences",2015 IEEE International Conference on Smart City/SocialCom/SustainCom (SmartCity),"5 May 2016","2015","","","856","859","Recent years have witnessed the fast growth of the use of the mobile applications (a.k.a. ""apps""). Detecting similar apps is a basic problem in the app ecosystem. It is not only beneficial to app search and recommender systems, but also helpful for people to discover new apps. State-of-the-art studies defined several app similarity functions by the metainformation of apps, such as descriptions and reviews, and succeeded to apply it to apps from Google Play. There do exist some app stores that provide similar app lists when people search. Obviously such similarity relation information will help improve similar app recommendation in app stores where app recommendation is of poor quality or even does not exist. However few methods take the existing similarity relations between apps from different app stores into consideration. Our approach attempts to use such relation information to learn a new app similarity function from these stores, and combine this new function with existing functions defined from meta-information of apps. With transfer learning, our proposed similarity function can be used in app stores where no similar apps are presented. Empirical results on Chinese app data sets show that our method outperforms the state-of-the-art method significantly.","","978-1-5090-1893-2","10.1109/SmartCity.2015.175","","https://ieeexplore.ieee.org/stamp/stamp.jsp?arnumber=7463830","Mobile Application;Similarity Function;Recommendation","Kernel;Training;Mobile applications;Training data;Recommender systems;Google","","1","","5","IEEE","5 May 2016","","","IEEE","IEEE Conferences"
"Using Diversity to Harden Multithreaded Programs Against Exploitation","D. M. Tagatac; M. Polychronakis; S. J. Stolfo","Columbia University, New York, NY, USA; Columbia University, New York, NY, USA; Stony Brook University, Stony Brook, NY, USA","2016 IEEE 2nd International Conference on Big Data Security on Cloud (BigDataSecurity), IEEE International Conference on High Performance and Smart Computing (HPSC), and IEEE International Conference on Intelligent Data and Security (IDS)","4 Jul 2016","2016","","","208","213","Multithreaded programming is here to stay, and concurrency bugs are the focus of a growing number of cyberattacks. While most defensive efforts against such attacks seek to identify bugs during debugging, an alternative method seeks to make exploitation harder without the need to first identify the bugs -- or even the fact that there are any. Time randomization introduces more diversity among instances of the same software. In much the same way that ASLR-induced diversity in memory locations thwarts attacks crafted for specific addresses, time randomization-induced diversity in thread timing aims to thwart concurrency attacks crafted for specific vulnerability windows. We study three implementations of time randomization, all using the injection of NOPs to alter program timing. Their application to two real-world concurrency bugs results in a marked increase in the cost to exploit those bugs. After demonstrating the effectiveness of the method, especially when NOPs are injected before library function calls following synchronization points, methods for improving the efficiency of this defense against concurrency attacks in future research are proposed.","","978-1-5090-2403-2","10.1109/BigDataSecurity-HPSC-IDS.2016.24","","https://ieeexplore.ieee.org/stamp/stamp.jsp?arnumber=7502291","time randomization;concurrency bugs;software diversity","Concurrent computing;Libraries;Software;Delays;Computer bugs;Synchronization","","","","27","IEEE","4 Jul 2016","","","IEEE","IEEE Conferences"
"Revisiting Binary Code Similarity Analysis Using Interpretable Feature Engineering and Lessons Learned","D. Kim; E. Kim; S. K. Cha; S. Son; Y. Kim","KAIST, Daejeon, South Korea; KAIST, Daejeon, South Korea; KAIST, Daejeon, South Korea; KAIST, Daejeon, South Korea; KAIST, Daejeon, South Korea",IEEE Transactions on Software Engineering,"18 Apr 2023","2023","49","4","1661","1682","Binary code similarity analysis (BCSA) is widely used for diverse security applications, including plagiarism detection, software license violation detection, and vulnerability discovery. Despite the surging research interest in BCSA, it is significantly challenging to perform new research in this field for several reasons. First, most existing approaches focus only on the end results, namely, increasing the success rate of BCSA, by adopting uninterpretable machine learning. Moreover, they utilize their own benchmark, sharing neither the source code nor the entire dataset. Finally, researchers often use different terminologies or even use the same technique without citing the previous literature properly, which makes it difficult to reproduce or extend previous work. To address these problems, we take a step back from the mainstream and contemplate fundamental research questions for BCSA. Why does a certain technique or a certain feature show better results than the others? Specifically, we conduct the first systematic study on the basic features used in BCSA by leveraging interpretable feature engineering on a large-scale benchmark. Our study reveals various useful insights on BCSA. For example, we show that a simple interpretable model with a few basic features can achieve a comparable result to that of recent deep learning-based approaches. Furthermore, we show that the way we compile binaries or the correctness of underlying binary analysis tools can significantly affect the performance of BCSA. Lastly, we make all our source code and benchmark public and suggest future directions in this field to help further research.","1939-3520","","10.1109/TSE.2022.3187689","Institute of Information & Communications Technology Planning & Evaluation(grant numbers:2021-0-01332); Developing Next-Generation Binary Decompiler; ","https://ieeexplore.ieee.org/stamp/stamp.jsp?arnumber=9813408","Binary code similarity analysis;similarity measures;feature evaluation and selection;benchmark","Benchmark testing;Computer architecture;Binary codes;Syntactics;Semantics;Licenses;Market research","","20","","166","CCBY","1 Jul 2022","","","IEEE","IEEE Journals"
"Quickly Generating Diverse Valid Test Inputs with Reinforcement Learning","S. Reddy; C. Lemieux; R. Padhye; K. Sen","University of California, Berkeley, USA; University of California, Berkeley, USA; University of California, Berkeley, USA; University of California, Berkeley, USA",2020 IEEE/ACM 42nd International Conference on Software Engineering (ICSE),"21 Dec 2020","2020","","","1410","1421","Property-based testing is a popular approach for validating the logic of a program. An effective property-based test quickly generates many diverse valid test inputs and runs them through a parameterized test driver. However, when the test driver requires strict validity constraints on the inputs, completely random input generation fails to generate enough valid inputs. Existing approaches to solving this problem rely on whitebox or greybox information collected by instrumenting the input generator and/or test driver. However, collecting such information reduces the speed at which tests can be executed. In this paper, we propose and study a black-box approach for generating valid test inputs. We first formalize the problem of guiding random input generators towards producing a diverse set of valid inputs. This formalization highlights the role of a guide which governs the space of choices within a random input generator. We then propose a solution based on reinforcement learning (RL), using a tabular, on-policy RL approach to guide the generator. We evaluate this approach, RLCheck, against pure random input generation as well as a state-of-the-art greybox evolutionary algorithm, on four real-world benchmarks. We find that in the same time budget, RLCheck generates an order of magnitude more diverse valid inputs than the baselines.","1558-1225","978-1-4503-7121-6","","Samsung; Facebook; Fujitsu; NSF(grant numbers:CCF-1900968,CCF-1908870,CNS-1817122); ","https://ieeexplore.ieee.org/stamp/stamp.jsp?arnumber=9284117","","Monte Carlo methods;Instruments;Reinforcement learning;Evolutionary computation;Benchmark testing;Generators;Software engineering","","2","","50","","21 Dec 2020","","","IEEE","IEEE Conferences"
"An adaptive diversity strategy for particle swarm optimization","Fang Wang; Naiqin Feng; Yuhui Qiu","Intelligent Software and Software Engineering Laboratory, Southwest University, Chongqing, China; Intelligent Software and Software Engineering Laboratory, Southwest University, Chongqing, China; Intelligent Software and Software Engineering Laboratory, Southwest University, Chongqing, China",2005 International Conference on Natural Language Processing and Knowledge Engineering,"27 Feb 2006","2005","","","760","764","In this paper, we present a diversity strategy for particle swarm optimizer. The modified algorithm re-initializes part of particles with poorer fitness during the searching process. It is empirically tested and compared with other published methods on many famous benchmark functions. The experimental results illustrate that the proposed algorithm has the potential to achieve higher success ratio and better solution quality. It is very competitive for hard multimodal function optimization.","","0-7803-9361-9","10.1109/NLPKE.2005.1598838","","https://ieeexplore.ieee.org/stamp/stamp.jsp?arnumber=1598838","","Particle swarm optimization;Software engineering;Laboratories;Benchmark testing;Birds;Optimization methods;Genetic engineering;Genetic algorithms;Convergence;Stochastic processes","","3","","14","IEEE","27 Feb 2006","","","IEEE","IEEE Conferences"
"Preparing for the Unexpected: Diversity Improves Planning Resilience in Evolutionary Algorithms","T. Gabor; L. Belzner; T. Phan; K. Schmid",LMU Munich; Maiborn Wolff; LMU Munich; LMU Munich,2018 IEEE International Conference on Autonomic Computing (ICAC),"21 Oct 2018","2018","","","131","140","As automatic optimization techniques find their way into industrial applications, the behavior of many complex systems is determined by some form of planner picking the right actions to optimize a given objective function. In many cases, the mapping of plans to objective reward may change due to unforeseen events or circumstances in the real world. In those cases, the planner usually needs some additional effort to adjust to the changed situation and reach its previous level of performance. Whenever we still need to continue polling the planner even during re-planning, it oftentimes exhibits severely lacking performance. In order to improve the planner's resilience to unforeseen change, we argue that maintaining a certain level of diversity amongst the considered plans at all times should be added to the planner's objective. Effectively, we encourage the planner to keep alternative plans to its currently best solution. As an example case, we implement a diversity-aware genetic algorithm using two different metrics for diversity (differing in their generality) and show that the blow in performance due to unexpected change can be severely lessened in the average case. We also analyze the parameter settings necessary for these techniques in order to gain an intuition how they can be incorporated into larger frameworks or process models for software and systems engineering.","2474-0756","978-1-5386-5139-1","10.1109/ICAC.2018.00023","","https://ieeexplore.ieee.org/stamp/stamp.jsp?arnumber=8498134","planning;resilience;robustness;self-protection;self-healing;diversity;optimization;evolutionary algorithms;unexpected events;dynamic fitness","Resilience;Planning;Optimization;Robustness;Production facilities;Evolutionary computation;Software","","6","","48","IEEE","21 Oct 2018","","","IEEE","IEEE Conferences"
"Downsized testers use diverse new technologies","J. Eidnes","Military Avionics Division, Honeywell, Inc., MN, USA",AUTOTESTCON 93,"6 Aug 2002","1993","","","585","590","Several diverse new technologies were brought together during the development of two downsized testers for the F-16 Central Air Data Computer. The small size, clean design, and ease of operation produced as a result of this project illustrated the effectiveness of integrating these new technologies into a single system. This paper discusses changes in the test station development process that were brought about by these new technologies.<>","","0-7803-0646-5","10.1109/AUTEST.1993.396304","","https://ieeexplore.ieee.org/stamp/stamp.jsp?arnumber=396304","","Hardware;Instruments;Military computing;Central air conditioning;Software testing;Microcomputers;Aerospace electronics;Software systems;Buildings;System testing","","","","1","IEEE","6 Aug 2002","","","IEEE","IEEE Conferences"
"CoMSS: Context based measure for semantic similarity between conceptual models","E. A. Kaundal; A. Kaur","Department of Computer Science Engineering, Chandigarh University, Gharuan, Punjab, India; Department of Computer Science Engineering, Chandigarh University, Gharuan, Punjab, India",2017 International Conference on Intelligent Computing and Control Systems (ICICCS),"11 Jan 2018","2017","","","1080","1088","Artifacts are defined as the tools which act as building block for developing a software or project. Artifacts are of several kinds like UML and BPMN. The overall connotation of the document in SDLC is combination of sensible or significant words represented in the form of different artifacts. In this approach main focus is on the precision of the documents or artifacts developed by requirement analysts. This phase is purely personal opinion oriented, later on which may cause rejection of the software during acceptance testing. Our aim is to preserve the overall meaning of the document that's why we compare the class diagram (conceptual model) with BPMN so that the meaning of the requirements provided by the stakeholders should be preserved in both forms of artifacts. The word specificity and word semantics plays vital role in assessing the semantic similarity between the two artifacts. In this paper the frequency (word specificity) is calculated between the vectors with the help of TF-IDF and the semantic similarity between the vectors is calculated with the help of WordNet algorithms. The proposed similarity measures are evaluated in divergent context, the benchmark dataset i.e SemEval (Semantic Evaluation) 2012 Semantic Textual Similarity test set, competition organized in 2012. Three standard case studies are used to evaluate the semantic similarity between the artifacts named as Rambaugh's ATM Model (Rambaugh et al. 1991), EFP (Kurt, 1995), Course Registration (IBM Corp, 2004).","","978-1-5386-2745-7","10.1109/ICCONS.2017.8250633","","https://ieeexplore.ieee.org/stamp/stamp.jsp?arnumber=8250633","Natural language processing;Vector space model;WordNet;Sentence similarity;CoMSS;TF-IDF;Semantic similarity;Knowledge Based systems;Information Retrieval","Semantics;Computational modeling;Software;Analytical models;Unified modeling language;Online banking;Control systems","","","","18","IEEE","11 Jan 2018","","","IEEE","IEEE Conferences"
"A Quantitative Analysis Framework for Recurrent Neural Network","X. Du; X. Xie; Y. Li; L. Ma; Y. Liu; J. Zhao","Nanyang Technological University, Singapore; Nanyang Technological University, Singapore; Nanyang Technological University, Singapore; Kyushu University, Japan; Nanyang Technological University, Singapore; Kyushu University, Japan",2019 34th IEEE/ACM International Conference on Automated Software Engineering (ASE),"9 Jan 2020","2019","","","1062","1065","Recurrent neural network (RNN) has achieved great success in processing sequential inputs for applications such as automatic speech recognition, natural language processing and machine translation. However, quality and reliability issues of RNNs make them vulnerable to adversarial attacks and hinder their deployment in real-world applications. In this paper, we propose a quantitative analysis framework - DeepStellar - to pave the way for effective quality and security analysis of software systems powered by RNNs. DeepStellar is generic to handle various RNN architectures, including LSTM and GRU, scalable to work on industrial-grade RNN models, and extensible to develop customized analyzers and tools. We demonstrated that, with DeepStellar, users are able to design efficient test generation tools, and develop effective adversarial sample detectors. We tested the developed applications on three real RNN models, including speech recognition and image classification. DeepStellar outperforms existing approaches three hundred times in generating defect-triggering tests and achieves 97% accuracy in detecting adversarial attacks. A video demonstration which shows the main features of DeepStellar is available at: https://sites.google.com/view/deepstellar/tool-demo.","2643-1572","978-1-7281-2508-4","10.1109/ASE.2019.00102","","https://ieeexplore.ieee.org/stamp/stamp.jsp?arnumber=8952565","recurrent neural netwrod;model abstraction;quantitative analysis;similarity metrics;coverage criteria","Testing;Tools;Training data;Statistical analysis;Recurrent neural networks;Security;Computer architecture","","5","","18","IEEE","9 Jan 2020","","","IEEE","IEEE Conferences"
"An empirical study on reliability modeling for diverse software systems","Xia Cai; M. R. Lyu","Department of Computer Science and Engineering, Chinese University of Hong Kong, Hong Kong, China; Department of Computer Science and Engineering, Chinese University of Hong Kong, Hong Kong, China",15th International Symposium on Software Reliability Engineering,"24 Jan 2005","2004","","","125","136","Reliability and fault correlation are two main concerns for design diversity, yet empirical data are limited in investigating these two. In previous work, we conducted a software project with real-world application for investigation on software testing and fault tolerance for design diversity. Mutants were generated by injecting one single real fault recorded in the software development phase to the final versions. In this paper, we perform more analysis and experiments on these mutants to evaluate and investigate the reliability features in diverse software systems. We apply our project data on two different reliability models and estimate the reliability bounds for evaluation purpose. We also parameterize fault correlations to predict the reliability of various combinations of versions, and compare three different fault-tolerant software architectures.","1071-9458","0-7695-2215-7","10.1109/ISSRE.2004.6","","https://ieeexplore.ieee.org/stamp/stamp.jsp?arnumber=1383112","","Software systems;Fault tolerance;Application software;Reliability engineering;Software testing;Aerospace electronics;Computer science;Data engineering;Design engineering;Programming","","3","","21","IEEE","24 Jan 2005","","","IEEE","IEEE Conferences"
"Learning from Open-Source Projects: An Empirical Study on Defect Prediction","Z. He; F. Peters; T. Menzies; Y. Yang","University of Chinese Academy of Sciences, Beijing, China; Lane Department of CS & EE, West Virginia University, Morgantown, USA; Lane Department of CS & EE, West Virginia University, Morgantown, USA; Lab for Internet Software Technology, Institute of Software Chinese Academy of Sciences, Beijing, China",2013 ACM / IEEE International Symposium on Empirical Software Engineering and Measurement,"12 Dec 2013","2013","","","45","54","The fundamental issue in cross project defect prediction is selecting the most appropriate training data for creating quality defect predictors. Another concern is whether historical data of open-source projects can be used to create quality predictors for proprietary projects from a practical point-of-view. Current studies have proposed statistical approaches to finding these training data, however, thus far no apparent effort has been made to study their success on proprietary data. Also these methods apply brute force techniques which are computationally expensive. In this work we introduce a novel data selection procedure which takes into account the similarities between the distribution of the test and potential training data. Additionally we use feature subset selection to increase the similarity between the test and training sets. Our procedure provides a comparable and scalable means of solving the cross project defect prediction problem for creating quality defect predictors. To evaluate our procedure we conducted empirical studies with comparisons to the within company defect prediction and a relevancy filtering method. We found that our proposed method performs relatively better than the filtering method in terms of both computation cost and prediction performance.","1949-3789","978-0-7695-5056-5","10.1109/ESEM.2013.20","","https://ieeexplore.ieee.org/stamp/stamp.jsp?arnumber=6681337","software defect prediction;cross-project;instance selection;feature subset selection;data similarity","Open source software;Training data;Predictive models;Data models;Training;Filtering","","89","","33","IEEE","12 Dec 2013","","","IEEE","IEEE Conferences"
"ASSD: Arabic Semantic Similarity Dataset","B. Dahy; M. Farouk; K. Fathy","Department of Computer Science, Faculty of Computers and Information (of Assiut University), Assiut, Egypt; Department of Computer Science, Faculty of Computers and Information (of Assiut University), Assiut, Egypt; Department of Computer Science, Faculty of Computers and Information (of Assiut University), Assiut, Egypt","2021 9th International Japan-Africa Conference on Electronics, Communications, and Computations (JAC-ECC)","3 Feb 2022","2021","","","130","134","Finding semantic similarity between sentences is very useful in many NLP applications, such as information retrieval, plagiarism detection, information extraction, and machine translation. Limitations in Arabic language resources have led to a poor level of research in Arabic sentence similarity. This challenge makes identifying semantically similar sentences in Arabic even more difficult. This paper presents a new Arabic dataset for the sentence similarity task. This dataset can be used to help develop sentence similarity approaches. In addition, the main purpose of the created dataset is to evaluate the sentence similarity approach. The dataset has been collected from Wikipedia, an intermediate lexicon, and other WWW resources. This paper gives more details about the processes of collecting data, filtering, preprocessing the pairs of sentences and some statistics about the dataset, for building a benchmark for semantic textual similarity. The dataset is available for future research in this field. The experiment shows that the created dataset is an efficient tool for evaluating semantic similarity approaches for the Arabic language.","","978-1-6654-8292-9","10.1109/JAC-ECC54461.2021.9691424","","https://ieeexplore.ieee.org/stamp/stamp.jsp?arnumber=9691424","Arabic Dataset;Arabic Semantic Similarity;Arabic Sentences Similarity;Arabic Word Similarity","Filtering;Plagiarism;Semantics;Buildings;Encyclopedias;Benchmark testing;Internet","","1","","44","IEEE","3 Feb 2022","","","IEEE","IEEE Conferences"
"Classification of Non-Functional Requirements Using Fuzzy Similarity KNN Based on ISO / IEC 25010","I. M. S. Raharja; D. O. Siahaan","Informatics Department, Institut Teknologi Sepuluh Nopember, Indonesia; Informatics Department, Institut Teknologi Sepuluh Nopember, Indonesia",2019 12th International Conference on Information & Communication Technology and System (ICTS),"30 Sep 2019","2019","","","264","269","In developing software, one of the important role is non-functional requirements. They are often forgotten by the developer, so that it causes adverse effects. For this reason, a non-functional requirement classification method is needed to make it easier for software developers to classify non-functional requirements from requirement document. Most of studies in this area are focusing on single label classification. However, a non-functional requirement sentence can be classified to more than one class. Therefore, a classification technique that support multi-labels was needed. This research proposes a model for classifying non-functional requirements into quality aspects based on ISO/IEe 25010. It uses Fuzzy Similarity KNN (FSKNN) for building the sentence-based classification model. Six difference dataset which is contain 1432 sentence is used in the test. Best accuracy, precision and recall value from classification using FSKNN respectively is 42.8%, 68.1%, and 55.9%.","","978-1-7281-2133-8","10.1109/ICTS.2019.8850944","","https://ieeexplore.ieee.org/stamp/stamp.jsp?arnumber=8850944","Non-Functional Requirements;Classification;FSKNN;ISO /IEC 25010","ISO Standards;Software quality;IEC Standards;Training data;Mathematical model","","9","","17","IEEE","30 Sep 2019","","","IEEE","IEEE Conferences"
