"Reports Aggregation of Crowdsourcing Test Based on Feature Fusion","L. Cai; N. Wang; M. Chen; J. Wang; J. Wang; J. Gong","Development Center of Computer Software Technology, Shanghai Key Laboratory of Computer Software Testing & Evaluating, Shanghai, Shanghai, China; Development Center of Computer Software Technology, Shanghai Key Laboratory of Computer Software Testing & Evaluating, Shanghai, Shanghai, China; Development Center of Computer Software Technology, Shanghai Key Laboratory of Computer Software Testing & Evaluating, Shanghai, Shanghai, China; Development Center of Computer Software Technology, Shanghai Key Laboratory of Computer Software Testing & Evaluating, Shanghai, Shanghai, China; Development Center of Computer Software Technology, Shanghai Key Laboratory of Computer Software Testing & Evaluating, Shanghai, Shanghai, China; Development Center of Computer Software Technology, Shanghai Key Laboratory of Computer Software Testing & Evaluating, Shanghai, Shanghai, China","2021 IEEE 21st International Conference on Software Quality, Reliability and Security Companion (QRS-C)","1 Apr 2022","2021","","","51","59","In recent years, a new testing method based on the concept of crowdsourcing has made great progress. Developers upload the project to the crowdsourcing test platform and recruit a large number of crowdsourcing workers for testing, so that the testing process has higher test adequacy, faster testing speed and lower testing cost. However, the test reports submitted after the test have serious problems such as large quantity and high similarity, resulting in the failure to achieve the expected results. Based on the method of feature fusion, this paper integrates the text description information, bug type information and screenshot information of crowdsourcing test reports, clusters crowdsourcing test reports through the calculation of similarity between reports, and finally achieves better results.","2693-9371","978-1-6654-7836-6","10.1109/QRS-C55045.2021.00018","National Key R&D Program of China(grant numbers:2018YFB1403400); ","https://ieeexplore.ieee.org/stamp/stamp.jsp?arnumber=9742039","crowdsourcing testing;similarity calculation;feature fusion","Crowdsourcing;Costs;Conferences;Machine learning;Software quality;Natural language processing;Mathematical models","","1","","32","IEEE","1 Apr 2022","","","IEEE","IEEE Conferences"
"Evaluation and Analysis of Spectrum-Based Fault Localization with Modified Similarity Coefficients for Software Debugging","Y. -S. You; C. -Y. Huang; K. -L. Peng; C. -J. Hsu","Institute of Information Systems and Applications, National Tsinghua University, Hsinchu, Taiwan; Inst. of Inf. Syst. & Applic., Nat. Tsinghua Univ., Hsinchu, Taiwan; Department of Computer Science; Department of Computer Science",2013 IEEE 37th Annual Computer Software and Applications Conference,"31 Oct 2013","2013","","","180","189","During the process of fault localization, the spectrum-based techniques are frequently used and widely studied since they can automatically and effectively localize the faults of software and be implemented easily. So far most of spectrum-based fault localization techniques have relied heavily on the use of similarity coefficients. However, we noticed that existing similarity coefficients for fault localization may lack measure(s) to properly reflect the relationship between failing and passing test cases. It also has to note that the failing test cases usually are expected to provide more information to the similarity coefficients than the passing test cases. In order to evaluate the importance of failing and passing test cases in the similarity coefficients, a number of modified similarity coefficients in fault localization are presented and discussed. The modified similarity coefficients which are assigned the weights of the failing and/or passing test cases will be studied and analyzed with the multi-coverage-combined techniques. Five open source programs and 75 faulty versions in total from Siemens suite, which have been widely used for software testing and comparison of fault localization techniques, were selected as experiment subjects. Detailed analysis of the results shows that assigning the weights of failing and passing test cases to the similarity coefficients would be able to localize the faults more effectively and accurately.","0730-3157","978-0-7695-4986-6","10.1109/COMPSAC.2013.32","","https://ieeexplore.ieee.org/stamp/stamp.jsp?arnumber=6649819","Fault Localization;Software Debugging;Software Testing;Similarity Coefficient","Computer bugs;Software testing;Fault diagnosis;Vectors;Software debugging","","11","","39","IEEE","31 Oct 2013","","","IEEE","IEEE Conferences"
"Black-Box Testing of Deep Neural Networks through Test Case Diversity","Z. Aghababaeyan; M. Abdellatif; L. Briand; R. S; M. Bagherzadeh","School of EECS, University of Ottawa, Ottawa, ON, Canada; Software and Information Technology Engineering Department, École de Technologie Supérieure, Montreal, QC, Canada; School of EECS, University of Ottawa, Ottawa, ON, Canada; Department of Research and Development, General Motors, Warren, MI, USA; School of EECS, University of Ottawa, Ottawa, ON, Canada",IEEE Transactions on Software Engineering,"15 May 2023","2023","49","5","3182","3204","Deep Neural Networks (DNNs) have been extensively used in many areas including image processing, medical diagnostics and autonomous driving. However, DNNs can exhibit erroneous behaviours that may lead to critical errors, especially when used in safety-critical systems. Inspired by testing techniques for traditional software systems, researchers have proposed neuron coverage criteria, as an analogy to source code coverage, to guide the testing of DNNs. Despite very active research on DNN coverage, several recent studies have questioned the usefulness of such criteria in guiding DNN testing. Further, from a practical standpoint, these criteria are white-box as they require access to the internals or training data of DNNs, which is often not feasible or convenient. Measuring such coverage requires executing DNNs with candidate inputs to guide testing, which is not an option in many practical contexts. In this paper, we investigate diversity metrics as an alternative to white-box coverage criteria. For the previously mentioned reasons, we require such metrics to be black-box and not rely on the execution and outputs of DNNs under test. To this end, we first select and adapt three diversity metrics and study, in a controlled manner, their capacity to measure actual diversity in input sets. We then analyze their statistical association with fault detection using four datasets and five DNNs. We further compare diversity with state-of-the-art white-box coverage criteria. As a mechanism to enable such analysis, we also propose a novel way to estimate fault detection in DNNs. Our experiments show that relying on the diversity of image features embedded in test input sets is a more reliable indicator than coverage criteria to effectively guide DNN testing. Indeed, we found that one of our selected black-box diversity metrics far outperforms existing coverage criteria in terms of fault-revealing capability and computational time. Results also confirm the suspicions that state-of-the-art coverage criteria are not adequate to guide the construction of test input sets to detect as many faults as possible using natural inputs.","1939-3520","","10.1109/TSE.2023.3243522","General Motors and Canada Research Chair; Natural Sciences and Engineering Research Council of Canada; ","https://ieeexplore.ieee.org/stamp/stamp.jsp?arnumber=10041782","Coverage;deep neural network;diversity;faults;test","Measurement;Testing;Feature extraction;Closed box;Fault detection;Neurons;Computational modeling","","19","","93","CCBY","9 Feb 2023","","","IEEE","IEEE Journals"
"A similarity-based approach for test case prioritization using historical failure data","T. B. Noor; H. Hemmati","Department of Computer Science, University of Manitoba, Winnipeg, Canada; Department of Computer Science, University of Manitoba, Winnipeg, Canada",2015 IEEE 26th International Symposium on Software Reliability Engineering (ISSRE),"14 Jan 2016","2015","","","58","68","Test case prioritization is a crucial element in software quality assurance in practice, specially, in the context of regression testing. Typically, test cases are prioritized in a way that they detect the potential faults earlier. The effectiveness of test cases, in terms of fault detection, is estimated using quality metrics, such as code coverage, size, and historical fault detection. Prior studies have shown that previously failing test cases are highly likely to fail again in the next releases, therefore, they are highly ranked, while prioritizing. However, in practice, a failing test case may not be exactly the same as a previously failed test case, but quite similar, e.g., when the new failing test is a slightly modified version of an old failing one to catch an undetected fault. In this paper, we define a class of metrics that estimate the test cases quality using their similarity to the previously failing test cases. We have conducted several experiments with five real world open source software systems, with real faults, to evaluate the effectiveness of these quality metrics. The results of our study show that our proposed similarity-based quality measure is significantly more effective for prioritizing test cases compared to existing test case quality measures.","","978-1-5090-0406-5","10.1109/ISSRE.2015.7381799","","https://ieeexplore.ieee.org/stamp/stamp.jsp?arnumber=7381799","Test case prioritization;Test quality metric;Similarity;Execution trace;Distance function;Historical data;Code coverage;Test size","Measurement;Testing;Fault detection;History;Context;Software quality","","49","1","32","IEEE","14 Jan 2016","","","IEEE","IEEE Conferences"
"Prefilter: A Fault Localization Method using Unlabelled Test Cases based on K-Means Clustering and Similarity","D. An; S. Wang; L. Zhu; X. Yang; X. Yan","School of Reliability and System Engineering, Beihang University, Beijing, China; School of Reliability and System Engineering, Beihang University, Beijing, China; School of Reliability and System Engineering, Beihang University, Beijing, China; School of Reliability and System Engineering, Beihang University, Beijing, China; Nanjing Research Institute of Electronic Engineering, Nanjing, China","2022 IEEE 22nd International Conference on Software Quality, Reliability, and Security Companion (QRS-C)","30 Mar 2023","2022","","","263","269","Current research begins to apply unlabelled test cases to fault localization. However, in these methods, the labeled test cases randomly selected as the basis for fault localization cannot cover enough execution information, which will reduce fault localization efficiency. In this paper, a method based on K-Means clustering and similarity is proposed. At the beginning of the test, K-Means clustering is performed on the test case suite and the test cases filtered can cover more execution information. Next, for the test cases with failed execution results, the test cases with similar execution information are filtered to better highlight the fault information in the failed test cases. Experiments on Defects4J datasets show that the proposed method can be combined with other technologies to improve their efficiency, and the proposed method also has good compatibility with traditional software fault localization algorithms. The average improvement reached 13.37% in 8 scenarios.","2693-9371","979-8-3503-1991-0","10.1109/QRS-C57518.2022.00046","","https://ieeexplore.ieee.org/stamp/stamp.jsp?arnumber=10076948","Fault localization;Software debugging;Unlabelled test cases;K-Means clustering;similarity;Test oracle","Location awareness;Software algorithms;Clustering algorithms;Software quality;Filtering algorithms;Information filters;Software reliability","","1","","16","IEEE","30 Mar 2023","","","IEEE","IEEE Conferences"
"A Theoretical and Empirical Study of Diversity-Aware Mutation Adequacy Criterion","D. Shin; S. Yoo; D. -H. Bae","School of Computing, KAIST, Daejeon, Republic of Korea; School of Computing, KAIST, Daejeon, Republic of Korea; School of Computing, KAIST, Daejeon, Republic of Korea",IEEE Transactions on Software Engineering,"14 Oct 2018","2018","44","10","914","931","Diversity has been widely studied in software testing as a guidance towards effective sampling of test inputs in the vast space of possible program behaviors. However, diversity has received relatively little attention in mutation testing. The traditional mutation adequacy criterion is a one-dimensional measure of the total number of killed mutants. We propose a novel, diversity-aware mutation adequacy criterion called distinguishing mutation adequacy criterion, which is fully satisfied when each of the considered mutants can be identified by the set of tests that kill it, thereby encouraging inclusion of more diverse range of tests. This paper presents the formal definition of the distinguishing mutation adequacy and its score. Subsequently, an empirical study investigates the relationship among distinguishing mutation score, fault detection capability, and test suite size. The results show that the distinguishing mutation adequacy criterion detects 1.33 times more unseen faults than the traditional mutation adequacy criterion, at the cost of a 1.56 times increase in test suite size, for adequate test suites that fully satisfies the criteria. The results show a better picture for inadequate test suites; on average, 8.63 times more unseen faults are detected at the cost of a 3.14 times increase in test suite size.","1939-3520","","10.1109/TSE.2017.2732347","Information & communications Technology Promotion (IITP); Korea government (MSIP)(grant numbers:R0126-17-1101); Software R&D for Model-based Analysis and Verification of Higher-order Large Complex System; ","https://ieeexplore.ieee.org/stamp/stamp.jsp?arnumber=7994647","Mutation testing;test adequacy criteria;diversity","Fault detection;Software engineering;Software testing;Correlation;Indexes;Subspace constraints","","24","","58","IEEE","27 Jul 2017","","","IEEE","IEEE Journals"
"Automatic Identification of High Impact Bug Report by Test Smells of Textual Similar Bug Reports","J. Ding; G. Fan; H. Yu; Z. Huang","Department of Computer Science and Engineering, East China University of Science and Technology; Department of Computer Science and Engineering, East China University of Science and Technology; Department of Computer Science and Engineering, East China University of Science and Technology; Department of Computer Science and Engineering, East China University of Science and Technology","2021 IEEE 21st International Conference on Software Quality, Reliability and Security (QRS)","10 Mar 2022","2021","","","446","457","Bug reports are written by the software stakeholders to track software defects and vulnerabilities. Since Software Quality Assurance (SQA) resources are limited, developers tend to resolve High-Impact Bugs (HIB) in advance. Prior research identified HIBs by analyzing the textual information in bug reports. However, they only consider textual information instead of the root cause of bugs, such as code quality. Since prior study revealed software test smells (i.e., sub-optimal test code implementation) are related to bug proneness, we intend to measure test smell distribution in textual similar bug reports to identify HIB reports. We first construct an effective model, which outperforms the baseline by 29.3% in terms of AUC-ROC. Secondly, we use SHAP to compute the importance of test smell features. Finally, we conduct an empirical survey to discuss the relationship between test smell and HIB reports. Result shows that Assertion Roulette and Conditional Test Logic test smell are important factors in distinguishing the types of bug reports.","2693-9177","978-1-6654-5813-9","10.1109/QRS54544.2021.00056","","https://ieeexplore.ieee.org/stamp/stamp.jsp?arnumber=9724899","high impact bug report;test code smell;software quality assurance;empirical software engineering","Codes;Computer bugs;Software quality;Predictive models;Reliability engineering;Software reliability;Security","","1","","41","IEEE","10 Mar 2022","","","IEEE","IEEE Conferences"
"The Comparative Evaluation of Test Prioritization Approaches in an Industrial Study","A. Ahmad; F. G. d. O. Neto; E. P. Enoiu; K. Sandahl; O. Leifler","Ericsson AB, Linköping, Sweden; Gothenburg University, Gothenburg, Sweden; Mälardalens University, Mälardalens, Sweden; Linköping University, Linköping, Sweden; Linköping University, Linköping, Sweden","2023 IEEE 23rd International Conference on Software Quality, Reliability, and Security Companion (QRS-C)","19 Feb 2024","2023","","","35","44","Many test prioritisation techniques have been proposed in order to improve test effectiveness of Continuous Integration (CI) pipelines. Particularly, diversity-based testing (DBT) has shown promising and competitive results to improve test effectiveness. We report on a case study considering the CI pipeline of Axis Communications in Sweden. We compared three different prioritisation approaches (i.e., diversity, failure history and time) in terms of their impact on coverage, failure detection rates and reduction on test execution time. Our results reveal that DBT is the best candidate to provide feature coverage, whereas failure rate prioritisation yields better failure coverage. Time-based prioritisation is not a reliable approach to provide cost-effective testing. Moreover, DBT would allow stakeholders to receive quick feedback on many combinations of integrated features to verify their code changes. Our participants report that developers are mainly interested in: (i) receiving quick feedback on a high combination of integrated features to verify their code changes, and (ii) associate their test suites to confidence scores representing the risk of missing failures given that fewer tests are executed.","2693-9371","979-8-3503-5939-8","10.1109/QRS-C60940.2023.00025","","https://ieeexplore.ieee.org/stamp/stamp.jsp?arnumber=10429997","diversity based testing;comparative evaluation;continuous integration;regression testing","Codes;Pipelines;Software quality;Software reliability;Stakeholders;Security;Testing","","","","64","IEEE","19 Feb 2024","","","IEEE","IEEE Conferences"
"From Diversity by Numbers to Diversity as Process: Supporting Inclusiveness in Software Development Teams with Brainstorming","A. Filippova; E. Trainer; J. D. Herbsleb","Institute for Software Research, Carnegie Mellon University, Pittsburgh, PA, USA; Institute for Software Research, Carnegie Mellon University, Pittsburgh, PA, USA; Institute for Software Research, Carnegie Mellon University, Pittsburgh, PA, USA",2017 IEEE/ACM 39th International Conference on Software Engineering (ICSE),"20 Jul 2017","2017","","","152","163","Negative experiences in diverse software development teams have the potential to turn off minority participants from future team-based software development activity. We examine the use of brainstorming as one concrete team processes that may be used to improve the satisfaction of minority developers when working in a group. Situating our study in time-intensive hackathon-like environments where engagement of all team members is particularly crucial, we use a combination of survey and interview data to test our propositions. We find that brainstorming strategies are particularly effective for team members who identify as minorities, and support satisfaction with both the process and outcomes of teamwork through different mechanisms.","1558-1225","978-1-5386-3868-2","10.1109/ICSE.2017.22","","https://ieeexplore.ieee.org/stamp/stamp.jsp?arnumber=7985658","Diversity;hackathons;teamwork;brainstorming;satisfaction;software engineering management","Software;Teamwork;Software engineering;Concrete;Cultural differences;Organizations","","39","","47","IEEE","20 Jul 2017","","","IEEE","IEEE Conferences"
"An Empirical Comparison of Similarity Measures for Abstract Test Case Prioritization","R. Huang; Y. Zhou; W. Zong; D. Towey; J. Chen","School of Computer Science and Communication Engineering, Jiangsu University, Zhenjiang, P.R. China; School of Computer Science and Communication Engineering, Jiangsu University, Zhenjiang, P.R. China; School of Computer Science and Communication Engineering, Jiangsu University, Zhenjiang, P.R. China; T School of Computer Science, The University of Nottingham Ningbo China, Ningbo, P.R. China; School of Computer Science and Communication Engineering, Jiangsu University, Zhenjiang, P.R. China",2017 IEEE 41st Annual Computer Software and Applications Conference (COMPSAC),"11 Sep 2017","2017","1","","3","12","Test case prioritization (TCP) attempts to order test cases such that those which are more important, according to some criterion or measurement, are executed earlier. TCP has been applied in many testing situations, including, for example, regression testing. An abstract test case (also called a model input) is an important type of test case, and has been widely used in practice, such as in configurable systems and software product lines. Similarity-based test case prioritization (STCP) has been proven to be cost-effective for abstract test cases (ATCs), but because there are many similarity measures which could be used to evaluate ATCs and to support STCP, we face the following question: How can we choose the similarity measure(s) for prioritizing ATCs that will deliver the most effective results? To address this, we studied fourteen measures and two popular STCP algorithms - local STCP (LSTCP), and global STCP (GSTCP). We also conducted an empirical study of five realworld programs, and investigated the efficacy of each similarity measure, according to the interaction coverage rate and fault detection rate. The results of these studies show that GSTCP outperforms LSTCP - in 61% to 84% of the cases, in terms of interaction coverage rates; and in 76% to 78% of the cases with respect to fault detection rates. Our studies also show that Overlap, the simplest similarity measure examined in this study, could obtain the overall best performance for LSTCP; and that Goodall3 has the best performance for GSTCP.","0730-3157","978-1-5386-0367-3","10.1109/COMPSAC.2017.271","","https://ieeexplore.ieee.org/stamp/stamp.jsp?arnumber=8029584","Software testing;test case prioritization;abstract test case;similarity","Testing;Fault detection;Software;Computer science;Software product lines;Fault diagnosis;Algorithm design and analysis","","8","","25","IEEE","11 Sep 2017","","","IEEE","IEEE Conferences"
"Prioritization of Metamorphic Relations Based on Test Case Execution Properties","M. Srinivasan","Gianforte School of Computing, Montana State University, Bozeman, United States",2018 IEEE International Symposium on Software Reliability Engineering Workshops (ISSREW),"18 Nov 2018","2018","","","162","165","A test oracle is essential for software testing. In certain complex systems, it is hard to distinguish between correct and incorrect behavior. Metamorphic testing is one of the solution to solve the test oracle problem. In metamorphic testing, metamorphic relations (MRs) are derived based on the properties exhibited by the program under test (PUT). These MRs play a major role in the generation of test data for conducting MT. The effectiveness of MRs can be determined based on the ability to detect considerable faults for the given PUT. Many metamorphic relations with different fault finding capability can be used to test the PUT and it is important to identify and prioritize the MRs based on its fault finding effectiveness. In order to answer this challenge, we propose to prioritize the MRs based on the diversity in the execution path of the source and follow-up test cases of the MRs. We propose four metrics to capture different levels of diversity in the execution behavior of the test cases for each of the derived MRs. The total weight calculated for each of the MRs using the metrics is used to prioritize the MRs.","","978-1-5386-9443-5","10.1109/ISSREW.2018.000-5","","https://ieeexplore.ieee.org/stamp/stamp.jsp?arnumber=8539189","Metamorphic Testing, Metamorphic Relations, Test case diversity, MR Prioritization","Measurement;Complexity theory;Indexes;Correlation;Tools;Software testing","","4","","13","IEEE","18 Nov 2018","","","IEEE","IEEE Conferences"
