"FAST Approaches to Scalable Similarity-Based Test Case Prioritization","B. Miranda; E. Cruciani; R. Verdecchia; A. Bertolino","Federal University of Pernambuco Recife, Brazil; Gran Sasso Science Institute, L’Aquila, Italy; Gran Sasso Science Institute, L’Aquila, Italy; ISTI - CNR, Pisa, Italy",2018 IEEE/ACM 40th International Conference on Software Engineering (ICSE),"2 Sep 2018","2018","","","222","232","Many test case prioritization criteria have been proposed for speeding up fault detection. Among them, similarity-based approaches give priority to the test cases that are the most dissimilar from those already selected. However, the proposed criteria do not scale up to handle the many thousands or even some millions test suite sizes of modern industrial systems and simple heuristics are used instead. We introduce the FAST family of test case prioritization techniques that radically changes this landscape by borrowing algorithms commonly exploited in the big data domain to find similar items. FAST techniques provide scalable similarity-based test case prioritization in both white-box and black-box fashion. The results from experimentation on real world C and Java subjects show that the fastest members of the family outperform other black-box approaches in efficiency with no significant impact on effectiveness, and also outperform white-box approaches, including greedy ones, if preparation time is not counted. A simulation study of scalability shows that one FAST technique can prioritize a million test cases in less than 20 minutes.","1558-1225","978-1-4503-5638-1","10.1145/3180155.3180210","","https://ieeexplore.ieee.org/stamp/stamp.jsp?arnumber=8453081","locality sensitive hashing;minhashing;scalability;similarity;software testing;test case prioritization","Scalability;History;Fault detection;Big Data;Software testing;Data mining","","31","","34","","2 Sep 2018","","","IEEE","IEEE Conferences"
"Identifying Similar Software Datasets through Fuzzy Inference System","S. Anwar; Z. A. Rana; M. M. Awais","Department of Computer Science, Department of Computer Science(SSE), LUMS, Lahore, Pakistan; Department of Computer Science, Department of Computer Science(SSE), LUMS, Lahore, Pakistan; Department of Computer Science, Department of Computer Science(SSE), LUMS, Lahore, Pakistan",2012 10th International Conference on Frontiers of Information Technology,"31 Jan 2013","2012","","","181","187","Similar software have similar software measurements. Defect data from one software can be used to anticipate defects in a similar software. Although, not many defect datasets are made public in software engineering domain, PROMISE repository is a reasonable collection of software data. This paper presents a two step approach to identify similar software and applies the proposed technique to find similar datasets in PROMISE repository. As step 1, the approach generates associations rules for each dataset to determine dataset's behavior in terms of frequent patterns. As step 2, overlap between the association rules is calculated using Fuzzy Inference Systems (FIS). The FIS generated for the study have been expert-based as well as auto-generated. Similarity between 28 dataset pairs has been found KC2 and PC1 turned out to be most similar datasets with 86% similarity using Mamdani, 92% with Sugeno models. Results from expert-based and auto generated FIS have been comparable.","","978-0-7695-4927-9","10.1109/FIT.2012.40","","https://ieeexplore.ieee.org/stamp/stamp.jsp?arnumber=6424319","software similarity;dataset similarity;software measures;FIS;fuzzy system;association rules","Software;Association rules;Fuzzy logic;Software measurement;Pragmatics;Testing","","","","17","IEEE","31 Jan 2013","","","IEEE","IEEE Conferences"
"[Invited] Quality Assurance of Machine Learning Software","S. NAKAJIMA","National Institute of Informatics, Tokyo, Japan",2018 IEEE 7th Global Conference on Consumer Electronics (GCCE),"13 Dec 2018","2018","","","601","604","Functionalities of machine learning software are dependent on a set of data input to them; a slight change in a training dataset has much impact on learning parameter values and thus on inference results. ML-based systems bring about a new challenge to quality assurance methods. This paper reviews two traditional views of service and product qualities. Furthermore, it introduces a platform view, in which co-creation of value is a major concern.","2378-8143","978-1-5386-6309-7","10.1109/GCCE.2018.8574766","","https://ieeexplore.ieee.org/stamp/stamp.jsp?arnumber=8574766","dataset diversity;metamorphic testing;service dominant logic;independent assessment","Machine learning;Training;Software;Quality assessment;Product design;Testing;Neural networks","","19","1","18","IEEE","13 Dec 2018","","","IEEE","IEEE Conferences"
"Test case analytics: Mining test case traces to improve risk-driven testing","T. B. Noor; H. Hemmati","Department of Computer Science, University of Manitoba, Winnipeg, Canada; Department of Computer Science, University of Manitoba, Winnipeg, Canada",2015 IEEE 1st International Workshop on Software Analytics (SWAN),"2 Apr 2015","2015","","","13","16","In risk-driven testing, test cases are generated and/or prioritized based on different risk measures. For example, the most basic risk measure would analyze the history of the software and assigns higher risk to the test cases that used to detect bugs in the past. However, in practice, a test case may not be exactly the same as a previously failed test, but quite similar. In this study, we define a new risk measure that assigns a risk factor to a test case, if it is similar to a failing test case from history. The similarity is defined based on the execution traces of the test cases, where we define each test case as a sequence of method calls. We have evaluated our new risk measure by comparing it to a traditional risk measure (where the risk measure would be increased only if the very same test case, not a similar one, failed in the past). The results of our study, in the context of test case prioritization, on two open source projects show that our new risk measure is by far more effective in identifying failing test cases compared to the traditional risk measure.","","978-1-4673-6923-7","10.1109/SWAN.2015.7070482","","https://ieeexplore.ieee.org/stamp/stamp.jsp?arnumber=7070482","Execution trace; Testing; Bug; Risk-driventesting; Similarity; Test case prioritization","Testing;History;Current measurement;Context;Software;Computer bugs;Databases","","13","","10","IEEE","2 Apr 2015","","","IEEE","IEEE Conferences"
"Research on automatic generation of test data for multi-path coverage","M. Zhang; H. Li","School of Computer & Information Technology, Research Center for Network Management, Beijing Jiaotong University, Beijing, China; School of Computer and Information Technology, Research Center for Network Management, Beijing Jiaotong University, Beijing, China","2021 4th International Conference on Advanced Electronic Materials, Computers and Software Engineering (AEMCSE)","19 Aug 2021","2021","","","1185","1188","Software testing is a complex and time-consuming task, especially in the part of test case design. Therefore, test automation can greatly reduce the consumption of manpower and material resources. The main work of this paper is as follows:1This article designs a total path similarity for the target path group of the code from the perspective of multi-path oriented. And relying on this to generate test data that meets multiple target paths at one time, so as to reduce the number of iterations and time spent.2This article is inspired by the fitness function design of genetic algorithm, and designs a fitness evaluation method for multi-path and single-path.3This paper selects the Beetle Antennae Search algorithm from existing intelligent optimization algorithms. Because it does not require too much information, it performs very well in low- dimensional problems, and only needs one longhorn beetle in the search process, which greatly reduces the amount of calculation. And it is applied to the triangle classification problem program, and compared with the traditional genetic algorithm at the same time. The experimental results verify the correctness of the method, and the Beetle Antennae Search algorithm is more efficient than the genetic algorithm.","","978-1-6654-1596-5","10.1109/AEMCSE51986.2021.00242","","https://ieeexplore.ieee.org/stamp/stamp.jsp?arnumber=9513033","Multi-path;Beetle Antennae Search algorithm;path similarity;genetic algorithm","Software testing;Software algorithms;Sociology;Search problems;Classification algorithms;Statistics;Task analysis","","1","","8","IEEE","19 Aug 2021","","","IEEE","IEEE Conferences"
"A Visualization of Specification Coverage Based on Document Similarity","H. Nakagawa; S. Matsui; T. Tsuchiya","Graduate School of Information Science and Technology, Osaka University, Osaka, Japan; Graduate School of Information Science and Technology, Osaka University, Osaka, Japan; Graduate School of Information Science and Technology, Osaka University, Osaka, Japan",2017 IEEE/ACM 39th International Conference on Software Engineering Companion (ICSE-C),"24 Aug 2017","2017","","","136","138","Code coverage is a metric used to represent how much code is tested when particular test cases are executed. As is code coverage, specification coverage is expected to help us to comprehend how much specification to be implemented is tested. In this study, we propose a visualization process for specification coverage. This process finds traceability links between specifications and test cases using a similarity metric and constructs two views for visualization. We develop a prototype tool for automatically executing the process and evaluate the process in a preliminary experiment on a web application development in industry. This extended abstract explains the overview of our study and the preliminary results.","","978-1-5386-1589-8","10.1109/ICSE-C.2017.117","","https://ieeexplore.ieee.org/stamp/stamp.jsp?arnumber=7965280","specification coverage;traceability;visualization;testing","Visualization;Software;Software engineering;Testing;Tools;HTML;Measurement","","2","","9","IEEE","24 Aug 2017","","","IEEE","IEEE Conferences"
"Software Defect Evaluation Methods for Embedded Real-Time Control System Based on Transfer Learning","X. Han; M. Bian; Z. Wu","China Electronic Product Reliability and Environmental Testing Research Institute, The fifth electronic research institute of MIIT, Guangzhou, China; China Electronic Product Reliability and Environmental Testing Research Institute, The fifth electronic research institute of MIIT, Guangzhou, China; China Electronic Product Reliability and Environmental Testing Research Institute, The fifth electronic research institute of MIIT, Guangzhou, China",2022 14th International Conference on Measuring Technology and Mechatronics Automation (ICMTMA),"7 Mar 2022","2022","","","247","255","In order to reduce the impact of environmental changes on software defect evaluation, an embedded real-time control system software defect evaluation method based on transfer learning is proposed. Firstly, the defect software measurement index is selected. On this basis, the relevant index features are divided into the same cluster by using the feature clustering technology. According to the distribution similarity of the features between the two items, the relevant features are found and the features with large distribution differences are removed. Select high-quality features from the source project to build the training data set, and select better evaluation data from the source project through weight adjustment to realize the accurate evaluation of software defects. The mapping results have clear objectives, and the error rate of the evaluation results of the design method is within 8.7, which has a good evaluation effect.","2157-1481","978-1-6654-9978-1","10.1109/ICMTMA54903.2022.00055","","https://ieeexplore.ieee.org/stamp/stamp.jsp?arnumber=9723949","transfer learning;embedded real-time control system;defect assessment;measurement index;clustering technology;distribution similarity","Training;Software testing;Correlation;Error analysis;Transfer learning;Training data;Software","","","","20","IEEE","7 Mar 2022","","","IEEE","IEEE Conferences"
"Implementation of Semantic Textual Similarity between Requirement Specification and Use Case Description Using WUP Method (Case Study: Sipjabs Application)","E. J. Sari; Y. Priyadi; R. R. Riskiana","Department of Informatics, Telkom University, Bandung, Indonesia; Department of Software Engineering, Telkom University, Bandung, Indonesia; Department of Software Engineering, Telkom University, Bandung, Indonesia",2022 IEEE World AI IoT Congress (AIIoT),"13 Jul 2022","2022","","","681","687","The SRS used in this study is an application called “Sipjabs”. This application processes data regarding the position of human resources to meet the needs of a company. This research aims to implement semantic textual similarity in software requirements specification through functional requirements with use case diagrams using the Wu Palmer (WUP) method in finding semantics. This research method is presented in a flow chart consisting of three main activities: research object analysis, semantic textual similarity, and validity and reliability testing. In this research, an extraction process for the Requirement Specification has been produced, divided into five documents: FR01, FR02, FR03, FR04, FR05. Then the steps performed in the use case description are divided into UD01, UD02, UD03, UD04, UD05. The highest similarity value is found in documents UD03 and FR03, where the number of similarities is 0.626640. In addition, the highest score of the sentence that has been calculated using the Wu Palmer concept is 0.8000, which is found in the words “page” and “user”. The highest kappa value with Gwet's AC1 formula is 0.02547770700636931, which means “Fair Agreement”. For the results of the calculation of the questionnaire filled in by the expert, namely 0.82022, which means “Almost Perfect”.","","978-1-6654-8453-4","10.1109/AIIoT54504.2022.9817311","","https://ieeexplore.ieee.org/stamp/stamp.jsp?arnumber=9817311","Semantic Textual Similarity;Requirement Specification;Use Case Description","Semantics;Companies;Software;Software reliability;Artificial intelligence;Testing","","8","","26","IEEE","13 Jul 2022","","","IEEE","IEEE Conferences"
"A Test Suite Reduction Approach to Improving the Effectiveness of Fault Localization","W. Fu; H. Yu; G. Fan; X. Ji; X. Pei",Department of Computer Science and Engineering; Department of Computer Science and Engineering; Department of Computer Science and Engineering; Department of Computer Science and Engineering; The Third Research Institute of the Ministry of Public Security,"2017 International Conference on Software Analysis, Testing and Evolution (SATE)","23 Nov 2017","2017","","","10","19","In order to improve the effectiveness of fault localization, various test suite reduction techniques have been proposed. However, excessive or improper reduction of test cases may lose some testing information, thus causing a negative impact on fault localization. In this paper, we propose a new similarity-based test suite reduction approach to improving spectrum-based fault localization. Firstly, this approach extracts the high suspicious statements in the faulty program and removes the coincidental passed test cases for test suite selection. Then, it selects similar passed test cases for each different failed test case from the new passed test set based on the similar proportion of their execution traces, and determines the final composition of each similar test set based on the contribution of failed test cases to fault localization. By using the execution information of each similar test set with a spectrum-based fault localization approach, the ranks of statements can be obtained. Finally, synthesizing all ranks of statements in each rank list, we obtain the final rank list of statements. Several experiments show that our approach can help reduce the debugging effort in terms of the percentage of statements needed to be inspected when locating faults in both single-fault and multi-fault programs. Moreover, the results demonstrate that the value of similar proportion have nontrivial influence on the effectiveness of fault localization.","","978-1-5386-3687-9","10.1109/SATE.2017.10","","https://ieeexplore.ieee.org/stamp/stamp.jsp?arnumber=8118516","debugging;fault localization;test case reduction;similar test case","Testing;Software debugging;Heuristic algorithms;Tools;Optimization;Aggregates","","5","","34","IEEE","23 Nov 2017","","","IEEE","IEEE Conferences"
"How effective is GeoGebra Software in improving students learning similarities of geometrical shapes","A. Eid; T. J. Abdulla","Department of Mathematics, University of Bahrain, Sukheer, Bahrain; Department of Mathematics, University of Bahrain, Sukheer, Bahrain",2021 Sustainable Leadership and Academic Excellence International Conference (SLAE),"6 Jun 2022","2021","","","1","5","The teaching and learning of geometry are changing due to the wide range of software and mobile applications that instructors can incorporate into their classes. Some students struggle with visualizing geometric shapes and related concepts, which affects their performances. GeoGebra, which is an open-source dynamic mathematical software, can enhance students' visualization and hence their learning of geometrical concepts. This study investigated the impact of using GeoGebra in teaching geometry specifically, the similarities of triangles concept, to first-year Landscape Engineering students enrolled in the ""Mathematics for Built Environment"" course at the University of Bahrain. The study was conducted on 38 students enrolled in the course. The research data were obtained from students' pre and post test results. The collected data were analyzed, and the results showed that GeoGebra was an effective tool for enhancing students learning and understanding of similarities of triangles concepts.","","978-1-6654-0714-4","10.1109/SLAE54202.2021.9788090","University of Bahrain; ","https://ieeexplore.ieee.org/stamp/stamp.jsp?arnumber=9788090","Analytic geometry;GeoGebra;dynamic mathematics software;Spatial Visualization;triangles similarities;mobile applications","Geometry;Leadership;Shape;Education;Mobile applications;Engineering students;Open source software","","","","20","IEEE","6 Jun 2022","","","IEEE","IEEE Conferences"
"Mobile Application GUI Similarity Comparison Based on Perceptual Hash for Automated Robot Testing","J. Cheng; W. Wang","School of Computer Science and Engineering, Xi'an Technological University, Shaanxi, China; School of Software, Northwestern Polytechnical University, Shaanxi, China","2021 International Conference on Intelligent Computing, Automation and Applications (ICAA)","30 Dec 2021","2021","","","245","251","Due to the rapid growth of mobile applications, the requirements for software testing speed are getting higher and higher. Therefore, automated testing is gradually replacing inefficient manual testing methods. However, most of the existing mobile applications are not open source code, and testing open source mobile applications is time-consuming and inefficient. Therefore, we propose automated robot testing based on black box testing. Firstly, YOLOV3 algorithm is used to obtain the information of mobile application interface components. Then, the perceptual hashing algorithm is used to identify the isomorphic GUI of mobile application, and the nodes that are the isomorphic GUI after the jump are merged to improve the test efficiency by simplifying the model. The experimental results show that the method can identify the isomorphic GUI quickly and accurately, and can better simplify the interface model and improve the test efficiency.","","978-1-6654-3730-1","10.1109/ICAA53760.2021.00052","","https://ieeexplore.ieee.org/stamp/stamp.jsp?arnumber=9653505","","Software testing;Codes;Computational modeling;Software algorithms;Semantics;Manuals;Mobile applications","","3","","6","IEEE","30 Dec 2021","","","IEEE","IEEE Conferences"
"Micro-inequities and immigration backgrounds in the software industry","V. Markulj; K. Aslam; E. Guzmán",Vrije Universiteit Amsterdam; Vrije Universiteit Amsterdam; Vrije Universiteit Amsterdam,2024 IEEE/ACM 46th International Conference on Software Engineering: Software Engineering in Society (ICSE-SEIS),"18 Jun 2024","2024","","","23","33","Micro-inequities are subtle, repetitive, and often unintentional forms of negative messaging, that can account for a significant burden over time. Research shows that racial and gender minority groups are more likely to experience micro-inequities, and that micro-inequities have a significant negative effect on self-esteem, work performance and career advancement. However, research on micro-inequities among software practitioners, particularly with an immigration perspective, is non-existent. To bridge this gap, we investigate the experiences of software practitioners, regarding micro-inequities from an immigration perspective. We surveyed 135 immigrant and non-immigrant software practitioners working in technical roles about verbal, nonverbal and environmental micro-inequities. Our results show that immigrants experience nine out of 27 investigated forms of micro-inequities significantly more than non-immigrants. These include not being given credit for their work, feeling excluded from key social or networking opportunities and being assumed to be less competent, assertive or intelligent. Our study can serve as an incentive for practitioners to adopt (more) inclusive work practices and to raise awareness about micro-inequities in the community.Lay Abstract: Micro-inequities are subtle, repetitive, and often unintentional forms of negative messaging, that can account for a significant burden over time. While research shows that underrepresented groups are more likely to experience micro-inequities, they have not been extensively studied in the software industry. In our work we survey 135 software practitioners regarding their experiences with micro-inequities in the software industry from an immigration perspective. Our findings show that immigrants experience some forms of micro-inequities significantly more than non-immigrants.","2832-7616","979-8-4007-0499-4","","","https://ieeexplore.ieee.org/stamp/stamp.jsp?arnumber=10554791","micro-inequities;immigration;diversity;inclusion;software development teams;questionnaire-based survey","Industries;Surveys;Bridges;Engineering profession;Employment;Software;Software engineering","","","","49","CCBY","18 Jun 2024","","","IEEE","IEEE Conferences"
"MACS: Multi-Agent Adversarial Reinforcement Learning for Finding Diverse Critical Driving Scenarios","S. Kang; Q. Dong; Y. Xue; W. Yanjun","University of Chinese Academy of Sciences, Beijing, China; Institute of Software Chinese Academy of Sciences, Beijing, China; Institute of Software Chinese Academy of Sciences, Beijing, China; Institute of Software Chinese Academy of Sciences, Beijing, China","2024 IEEE Conference on Software Testing, Verification and Validation (ICST)","27 Aug 2024","2024","","","1","12","Critical scenario generation plays a crucial role in the autonomous driving test by efficiently and effectively identifying various hazardous scenarios to evaluate the multiagent system under test. The performance of existing solution models is hampered by sparse rewards resulting from long time-steps in driving scenarios. Moreover, they fail to guide the generation of more diverse scenarios because of the lack of a fine-grained design. To efficiently and effectively discover various critical scenarios, we propose the MACS method based on multiagent reinforcement learning to guide adversaries foiled the agent under test by replay buffer optimization and objective function design. By adopting the hindsight experience replay method, historical experiences are reused to address the challenge of sparse rewards and improve sample efficiency. Furthermore, we integrate the entropy term into the objective function to explore different driving strategies, thereby leading to the creation of diverse scenarios. We have achieved a new state-of-the-art performance in evaluating rule-based agents using an industrial-grade platform, SMARTS. The experimental results demonstrate that MACS can effectively generate diverse critical scenarios that lead to the failure of the agent under test. We also apply cluster methods, including DBSCAN and TRACLUS, to conduct diversity analysis of the generated scenarios. Besides, we evaluate and improve the reinforcement learning decision algorithm for the vehicle under test with our generated scenarios and give empirical conclusions about its robustness.","2159-4848","979-8-3503-0818-1","10.1109/ICST60714.2024.00010","","https://ieeexplore.ieee.org/stamp/stamp.jsp?arnumber=10638588","Software Reliability;Search-based Test Generation;Reinforcement Learning;Critical Scenarios;Autonomous Driving","Software testing;Software algorithms;Reinforcement learning;Linear programming;Software;Robustness;Software reliability","","","","50","IEEE","27 Aug 2024","","","IEEE","IEEE Conferences"
