"Fostering the Diversity of Exploratory Testing in Web Applications","J. Leveau; X. Blanc; L. Réveillère; J. -R. Falleri; R. Rouvoy","Univ. Bordeaux, Bordeaux INP, CNRS, LaBRI, Talence, France; Univ. Bordeaux, Bordeaux INP, CNRS, LaBRI, Talence, France; Univ. Bordeaux, Bordeaux INP, CNRS, LaBRI, Talence, France; Univ. Bordeaux, Bordeaux INP, CNRS, LaBRI, Talence, France; Univ. Lille / Inria, France","2020 IEEE 13th International Conference on Software Testing, Validation and Verification (ICST)","5 Aug 2020","2020","","","164","174","Exploratory testing (ET) is a software testing approach that complements automated testing by leveraging business expertise. It has gained momentum over the last decades as it appeals testers to exploit their business knowledge to stress the system under test (SUT). Exploratory tests, unlike automated tests, are defined and executed on-the-fly by testers. Testers who perform exploratory tests may be biased by their past experience and therefore may miss anomalies or unusual interactions proposed by the SUT. This is even more complex in the context of web applications, which typically expose a huge number of interaction paths to their users. As testers of these applications cannot remember all the sequences of interactions they performed, they may fail to deeply explore the application scope. This paper therefore introduces a new approach to assist testers in widely exploring any web application. In particular, our approach monitors the online interactions performed by the testers to suggest in real-time the probabilities of performing next interactions. Looking at these probabilities, we claim that the testers who favour interactions that have a low probability (because they were rarely performed), will increase the diversity of their explorations. Our approach defines a prediction model, based on ${n}$-grams, that encodes the history of past interactions and that supports the estimation of the probabilities. Integrated within a web browser extension, it automatically and transparently injects feedback within the application itself. We conduct a controlled experiment and a qualitative study to assess our approach. Results show that it prevents testers to be trapped in already tested loops, and succeeds to assist them in performing deeper explorations of the SUT.","2159-4848","978-1-7281-5778-8","10.1109/ICST46399.2020.00026","","https://ieeexplore.ieee.org/stamp/stamp.jsp?arnumber=9159101","test;Exploratory test;n-gram;web applications","Predictive models;Computational modeling;Monitoring;Software testing;Buildings;Context modeling","","","","26","IEEE","5 Aug 2020","","","IEEE","IEEE Conferences"
"Bypassing the Combinatorial Explosion: Using Similarity to Generate and Prioritize T-Wise Test Configurations for Software Product Lines","C. Henard; M. Papadakis; G. Perrouin; J. Klein; P. Heymans; Y. Le Traon","Interdisciplinary Centre for Security, Reliability and Trust, University of Luxembourg, Luxembourg; Interdisciplinary Centre for Security, Reliability and Trust, University of Luxembourg, Luxembourg; Interdisciplinary Centre for Security, Reliability and Trust, University of Luxembourg, Luxembourg; Interdisciplinary Centre for Security, Reliability and Trust, University of Luxembourg, Luxembourg; Interdisciplinary Centre for Security, Reliability and Trust, University of Luxembourg, Luxembourg; Interdisciplinary Centre for Security, Reliability and Trust, University of Luxembourg, Luxembourg",IEEE Transactions on Software Engineering,"8 Jul 2014","2014","40","7","650","670","Large Software Product Lines (SPLs) are common in industry, thus introducing the need of practical solutions to test them. To this end, $t$-wise can help to drastically reduce the number of product configurations to test. Current $t$-wise approaches for SPLs are restricted to small values of $t$. In addition, these techniques fail at providing means to finely control the configuration process. In view of this, means for automatically generating and prioritizing product configurations for large SPLs are required. This paper proposes (a) a search-based approach capable of generating product configurations for large SPLs, forming a scalable and flexible alternative to current techniques and (b) prioritization algorithms for any set of product configurations. Both these techniques employ a similarity heuristic. The ability of the proposed techniques is assessed in an empirical study through a comparison with state of the art tools. The comparison focuses on both the product configuration generation and the prioritization aspects. The results demonstrate that existing  $t$-wise tools and prioritization techniques fail to handle large SPLs. On the contrary, the proposed techniques are both effective and scalable. Additionally, the experiments show that the similarity heuristic can be used as a viable alternative to $t$ -wise.","1939-3520","","10.1109/TSE.2014.2327020","","https://ieeexplore.ieee.org/stamp/stamp.jsp?arnumber=6823132","Software product lines;testing;T-wise Interactions;search-based approaches;prioritization;similarity","Testing;Frequency modulation;Context;Scalability;Software;Linux;Arrays","","146","","64","IEEE","29 May 2014","","","IEEE","IEEE Journals"
"Cluster-Based Parallel Testing Using Semantic Analysis","C. Landing; S. Tahvili; H. Haggren; M. Langkvis; A. Muhammad; A. Loufi","School of Science and Technology, Örebro University, Örebro, Sweden; Global Artificial Intelligence Accelerator (GAIA), Ericsson AB, Stockholm, Sweden; Global Artificial Intelligence Accelerator (GAIA), Ericsson AB, Stockholm, Sweden; School of Science and Technology, Örebro University, Örebro, Sweden; Global Artificial Intelligence Accelerator (GAIA), Ericsson AB, Stockholm, Sweden; School of Science and Technology, Örebro University, Örebro, Sweden",2020 IEEE International Conference On Artificial Intelligence Testing (AITest),"25 Aug 2020","2020","","","99","106","Finding a balance between testing goals and testing resources can be considered as a most challenging issue, therefore test optimization plays a vital role in the area of software testing. Several parameters such as the objectives of the tests, test cases similarities and dependencies between test cases need to be considered, before attempting any optimization approach. However, analyzing corresponding testing artifacts (e.g. requirement specification, test cases) for capturing the mentioned parameters is a complicated task especially in a manual testing procedure, where the test cases are documented as a natural text written by a human. Thus, utilizing artificial intelligence techniques in the process of analyzing complex and sometimes ambiguous test data, is considered to be working in different industries. Test scheduling is one of the most popular and practical ways to optimize the testing process. Having a group of test cases which are required the same system setup, installation or testing the same functionality can lead to a more efficient testing process. In this paper, we propose, apply and evaluate a natural language processing-based approach that derives test cases' similarities directly from their test specification. The proposed approach utilizes the Levenshtein distance and converts each test case into a string. Test cases are then grouped into several clusters based on their similarities. Finally, a set of cluster-based parallel test scheduling strategies are proposed for execution. The feasibility of the proposed approach is studied by an empirical evaluation that has been performed on a Telecom use-case at Ericsson in Sweden and indicates promising results.","","978-1-7281-6984-2","10.1109/AITEST49225.2020.00022","","https://ieeexplore.ieee.org/stamp/stamp.jsp?arnumber=9176809","Software Testing;Natural Language Processing;Test Optimization;Semantic Similarity;Clustering","Testing;Optimization;Job shop scheduling;Semantics;Manuals;Standards;Software","","3","","51","IEEE","25 Aug 2020","","","IEEE","IEEE Conferences"
"GUI Test Case Prioritization by State-Coverage Criterion","Z. -W. He; C. -G. Bai","Department of Automatic Control, Beijing University of Aeronautics and Astronautics, Beijing, China; Department of Automatic Control, Beijing University of Aeronautics and Astronautics, Beijing, China",2015 IEEE/ACM 10th International Workshop on Automation of Software Test,"27 Jul 2015","2015","","","18","22","Graphical User Interface (GUI) application is a kind of typical event-driven software (EDS) that transforms state according to input events invoked through a user interface. It is time consuming to test a GUI application since there are a large number of possible event sequences generated by the permutations and combinations of user operations. Although some GUI test case prioritization techniques have been proposed to determine ""which test case to execute next"" for early fault detection, most of them use random ordering to break tie cases, which has been proved to be ineffective. Recent research presents the opinion that using hybrid criteria can be an effective way for tie-breaking, but few studies focus on seeking a new criterion cooperating well with other criteria when breaking tie cases. In this paper, we propose a state-distance-based method using state coverage as a new criterion to prioritize GUI test cases. An empirical study on three GUI programs reveals that the state-distance-based method is really suitable for GUI test case prioritization and can cooperate well with the (additional) event length criterion.","","978-1-4673-7022-6","10.1109/AST.2015.11","","https://ieeexplore.ieee.org/stamp/stamp.jsp?arnumber=7166260","GUI testing;event-driven software;test case prioritization;GUI state similarity","Graphical user interfaces;Testing;Software;Fault detection;Software engineering;Measurement;Conferences","","5","1","11","IEEE","27 Jul 2015","","","IEEE","IEEE Conferences"
"Syntax-Tree Similarity for Test-Case Derivability in Software Requirements","S. Masuda; T. Matsuodani; K. Tsuda","IBM Research, Chuou-ku, Tokyo, Japan; Debug Engineering Research Laboratory, Tama-shi, Tokyo, Japan; University of Tsukuba, Bunkyo-ku, Tokyo, Japan","2021 IEEE International Conference on Software Testing, Verification and Validation Workshops (ICSTW)","28 May 2021","2021","","","162","172","Software testing has been important for software engineering to contribute to developing high-quality software. Decision table testing is a general technique to derive test cases with information on conditions and actions from software requirements. Deriving conditions and actions from requirements is key for efficient decision table testing. This paper proposes and evaluates a syntax-tree similarity method for test-case derivability in software requirements. We define the syntax-tree similarity technique used in our method as selecting test-case-derivable sentences from requirements at pre-processing. The syntax tree is defined as divided into sub-trees that consist of a root to each leaf. The syntax-tree similarity technique calculates the similarity between each sentence in the requirements and test-case-derivable sentence. The method involves natural language processing to select test-case-derivable sentences from the requirements on the basis of syntax-tree similarity then determines conditions and actions through dependency and case analyses. After selecting requirements by syntax-tree similarity, our method derives conditions and actions from the requirements by the deriving rules we define. Experiments revealed that the F-measure of the accuracy of the derived conditions and actions increased 16% from that reported in prior work. The results from case studies further indicate the effectiveness of our method.","","978-1-6654-4456-9","10.1109/ICSTW52544.2021.00037","","https://ieeexplore.ieee.org/stamp/stamp.jsp?arnumber=9440190","derive test cases;syntax-tree similarity;software requirements","Software testing;Conferences;Prototypes;Manuals;Syntactics;Software;Natural language processing","","","","47","IEEE","28 May 2021","","","IEEE","IEEE Conferences"
"A Similarity Metric for the Inputs of OO Programs and Its Application in Adaptive Random Testing","J. Chen; F. -C. Kuo; T. Y. Chen; D. Towey; C. Su; R. Huang","School of Computer Science and Communication Engineering, Jiangsu University, Zhenjiang, China; Department of Computer Science and Software Engineering, Swinburne University of Technology, Hawthorn, VIC, Australia; Department of Computer Science and Software Engineering, Swinburne University of Technology, Hawthorn, VIC, Australia; School of Computer Science, University of Nottingham Ningbo China, Ningbo, China; School of Computer Science and Communication Engineering, Jiangsu University, Zhenjiang, China; School of Computer Science and Communication Engineering, Jiangsu University, Zhenjiang, China",IEEE Transactions on Reliability,"2 Jun 2017","2017","66","2","373","402","Random testing (RT) has been identified as one of the most popular testing techniques, due to its simplicity and ease of automation. Adaptive random testing (ART) has been proposed as an enhancement to RT, improving its fault-detection effectiveness by evenly spreading random test inputs across the input domain. To achieve the even spreading, ART makes use of distance measurements between consecutive inputs. However, due to the nature of object-oriented software (OOS), its distance measurement can be particularly challenging: Each input may involve multiple classes, and interaction of objects through method invocations. Two previous studies have reported on how to test OOS at a single-class level using ART. In this study, we propose a new similarity metric to enable multiclass level testing using ART. When generating test inputs (for multiple classes, a series of objects, and a sequence of method invocations), we use the similarity metric to calculate the distance between two series of objects, and between two sequences of method invocations. We integrate this metric with ART and apply it to a set of open-source OO programs, with the empirical results showing that our approach outperforms other RT and ART approaches in OOS testing.","1558-1721","","10.1109/TR.2016.2628759","National Natural Science Foundation of China(grant numbers:61202110,61502205); Postdoctoral Science Foundation of China(grant numbers:2015M571687,2015M581739); Australian Research Council(grant numbers:DP 120104773); ","https://ieeexplore.ieee.org/stamp/stamp.jsp?arnumber=7790883","Adaptive random testing (ART);method invocation;object distance;object-oriented software (OOS) testing;test input distance","Subspace constraints;Measurement;Software;Power capacitors;Software testing;Computer science","","24","","49","IEEE","19 Dec 2016","","","IEEE","IEEE Journals"
"Evaluating String Distance Metrics for Reducing Automatically Generated Test Suites","I. T. Elgendy; R. M. Hierons; P. McMinn","University of Sheffield, Sheffield, UK; University of Sheffield, Sheffield, UK; University of Sheffield, Sheffield, UK",2024 IEEE/ACM International Conference on Automation of Software Test (AST),"18 Jun 2024","2024","","","171","181","Regression test suites can have a large number of test cases, especially automatically generated ones, and tend to grow in size making it costly to run the entire test suite. Test suite reduction aims to eliminate some test cases to reduce the test suite size and therefore reduce the cost of running it. In this paper, string distances on the text of the test cases are used as measures of similarity for reduction. A practical benefit of using string distance is that there is no need to run the test cases: the test suite source code is the only requirement, making the approach fast. We reduce test suites generated from Randoop and EvoSuite; two well-known test generation tools of Java programs. We implemented a string-based similarity reduction and compared it against random reduction. In the experiments, mutation scores using reduced test suites based on maximising string dissimilarity of test cases were higher than those for random reduction in over 70% of the test suites generated Also, the results showed that test suites generated by Randoop can be drastically reduced in one case by 99% using the string-based similarity reduction approach while maintaining the fault-finding capabilities of the original test suite. Finally, on average, the normalised compression distance was found to be the best similarity metric choice in terms of fault-detection. CCS CONCEPTS • Software and its engineering $\rightarrow$ Software testing and debugging; Empirical software validation.","2833-9061","979-8-4007-0588-5","","","https://ieeexplore.ieee.org/stamp/stamp.jsp?arnumber=10556457","Test suite reduction;Similarity-based testing;Diversity-based testing;Automatically generated tests","Measurement;Software testing;Java;Costs;Automation;Source coding;Debugging","","","","37","","18 Jun 2024","","","IEEE","IEEE Conferences"
"Software Vulnerability Detection Based on Code Coverage and Test Cost","B. Shuai; H. Li; L. Zhang; Q. Zhang; C. Tang","School of Electronic Science and Engineering, National University of Defense Technology, Changsha, Hunan, P. R. China; School of Electronic Science and Engineering, National University of Defense Technology, Changsha, Hunan, China; School of Electronic Science and Engineering, National University of Defense Technology, Changsha, Hunan, China; School of Electronic Science and Engineering, National University of Defense Technology, Changsha, Hunan, China; School of Electronic Science and Engineering, National University of Defense Technology, Changsha, Hunan, China",2015 11th International Conference on Computational Intelligence and Security (CIS),"4 Feb 2016","2015","","","317","321","In order to solve the problems of traditional Fuzzing technique for software vulnerability detection, a novel method based on code coverage and test cost is proposed. Firstly, static analysis is applied to calculate the code coverage information, including basic block coverage and new block coverage. In addition, test path diversity information is introduced to elevate path coverage, which is achieved based on the sequence alignment algorithm. Secondly, test cost is analyzed respectively from running time and loop structure. The loop structure is simplified using finite expansion manner. Thirdly, the genetic algorithm fitness function is constructed based on the code coverage and test cost to guide the test case generation. Experiments on realistic binary software show that the method could obtain higher vulnerability detection accuracy and efficiency than the traditional Fuzzing technique.","","978-1-4673-8660-9","10.1109/CIS.2015.84","","https://ieeexplore.ieee.org/stamp/stamp.jsp?arnumber=7397098","code coverage;test cost;test path diversity;genetic algorithm","Software;Genetic algorithms;Security;Algorithm design and analysis;Software algorithms;Optimization;Search problems","","3","1","30","IEEE","4 Feb 2016","","","IEEE","IEEE Conferences"
"Mining Similar Methods for Test Adaptation","D. Sondhi; M. Jobanputra; D. Rani; S. Purandare; S. Sharma; R. Purandare","Department of Computer Science and Engineering, Indraprastha Institute of Information Technology Delhi, New Delhi, Delhi, India; IIT Madras, Chennai, Tamil Nadu, India; Department of Computer Science and Engineering, GITA Bhubaneswar, Bhubaneswar, Odisha, India; Department of Computer Science and Engineering, Indraprastha Institute of Information Technology Delhi, New Delhi, Delhi, India; Department of Computer Science and Engineering, IIIT Bhubaneswar, Bhubaneswar, Odisha, India; Department of Computer Science and Engineering, Indraprastha Institute of Information Technology Delhi, New Delhi, Delhi, India",IEEE Transactions on Software Engineering,"15 Jul 2022","2022","48","7","2262","2276","Developers may choose to implement a library despite the existence of similar libraries, considering factors such as computational performance, language or platform dependency, accuracy, convenience, and completeness of an API. As a result, GitHub hosts several library projects that have overlaps in their functionalities. These overlaps have been of interest to developers from the perspective of code reuse or the preference of one implementation over the other. Through an empirical study, we explore the extent and nature of existence of these similarities in the library functions. We have further studied whether the similarity of functions across different libraries and their associated test suites can be leveraged to reveal defects in one another. We see scope for effectively using the mining of test suites from the perspective of revealing defects in a program or its documentation. Another noteworthy observation made in the study is that similar functions may exist across libraries implemented in the same language as well as in different languages. Identifying the challenges that lie in building a testing tool, we automate the entire process in Metallicus, a test mining and recommendation tool. Metallicus returns a test suite for the given input of a query function and a template for its test suite. On a dataset of query functions taken from libraries implemented in Java or Python, Metallicus revealed 46 defects.","1939-3520","","10.1109/TSE.2021.3057163","Department of Science and Technology (DST) (India); Science and Engineering Research Board; Confederation of Indian Industry; Microsoft Research; Infosys Center for AI; ","https://ieeexplore.ieee.org/stamp/stamp.jsp?arnumber=9347715","Test suites;mining;software testing;function similarity","Libraries;Testing;Tools;Software development management;Python;Documentation;Open source software","","1","","48","IEEE","4 Feb 2021","","","IEEE","IEEE Journals"
"Test Case Update Detection Using Graph Similarity of UML State Machine in Early Development Process","A. N. Ponco Bimantoro; S. Rochimah; S. Arifiani","Departement of Informatics Institut Teknologi Sepuluh Nopember, Surabaya, Indonesia; Departement of Informatics Institut Teknologi Sepuluh Nopember, Surabaya, Indonesia; Departement of Informatics Institut Teknologi Sepuluh Nopember, Surabaya, Indonesia","2021 8th International Conference on Information Technology, Computer and Electrical Engineering (ICITACEE)","3 Dec 2021","2021","","","143","148","Test case and its data test are part of software testing, which is a crucial phase of software development. Usually, testing is commonly done by explanatory testing and test case-based testing. However, both testing can be very costly and take most of the development time. Moreover, the test case data generated in the early step of development processes could be invalid as its designed algorithm or software might be revised. Therefore, in this study, we proposed a graph similarity of transformed UML State Machine Diagram to justify whether a feature's algorithm data test needs an update or not. We conducted the test on East Java's student admission portal namely PPDB 2017, 2018, and 2019. From the experiment conducted, we found that our proposed method shows promising results with high precision (up to 100%) and 95.6% recall. Thus, our proposed method can be very useful in the early step of development processes because it can save both time and cost since we can detect which features need a new test case data.","","978-1-6654-3998-5","10.1109/ICITACEE53184.2021.9617486","ITS; ","https://ieeexplore.ieee.org/stamp/stamp.jsp?arnumber=9617486","Data test;graph similarity;state machine diagram;UML","Software testing;Electrical engineering;Java;Costs;Unified modeling language;Software algorithms;Feature extraction","","1","","12","IEEE","3 Dec 2021","","","IEEE","IEEE Conferences"
