"A grid execution environment similarity metric","Wei Wang; Bin-Xing Fang","Department of Computer Science, Harbin Institute of Technology, Harbin, Heilongjiang, China; Department of Computer Science, Harbin Institute of Technology, Harbin, Heilongjiang, China",2005 International Conference on Machine Learning and Cybernetics,"7 Nov 2005","2005","5","","3007","3012 Vol. 5","A program's behavior is always tightly related with the computing environment where it runs, especially for parallel programs running in grid. Debugging tries to locate the reason for incorrect program behavior by analyzing the states, which happen during a program's execution. In order to allow cyclic debugging, re-execution mechanisms are used most frequently. The dynamic characteristics of grid will hinder re-execution to work, because the behavior of a program will be various according to the current configuration of execution environment. By modeling grid environments with graphics, this paper proposes the metric to evaluate the similarity between grid applications execution environments. The GA based resource selection algorithm is presented to construct similar execution environments in grids. A serial of experiments shows that the similarity metrics is appropriate.","2160-1348","0-7803-9091-1","10.1109/ICMLC.2005.1527458","","https://ieeexplore.ieee.org/stamp/stamp.jsp?arnumber=1527458","Grid;parallel debugging;computing environment;resource management;similarity metric;genetic algorithm","Debugging;Grid computing;Machine learning algorithms;Concurrent computing;Graphics;Resource management;Software testing;Costs;Runtime;Distributed computing","","","","11","IEEE","7 Nov 2005","","","IEEE","IEEE Conferences"
"Visualizing similarity between program executions","D. Leon; A. Podgurski; W. Dickinson","Corporacion NGS, Ciudad Guayana, Venezuela; EECS Department, Case Western Reserve University, Cleveland, OH, USA; Fused MultiModality Imaging, Solon, OH, USA",16th IEEE International Symposium on Software Reliability Engineering (ISSRE'05),"5 Dec 2005","2005","","","11 pp.","321","Multidimensional scaling (MDS) is a technique for visualizing multidimensional data points as a 2D scatter plot. It can be applied to execution profiles of software to reveal how similar executions are to one another. This is useful for certain software engineering applications, which require accurate representation of small dissimilarities and nearest neighbor relationships. However, the high-dimensionality of profiles can cause MDS techniques to represent small dissimilarities poorly. We evaluate several variants of MDS on large sets of profiles, to see which techniques produce the most accurate displays. These include four previously proposed techniques -classical scaling followed by iterative majorization, energy minimization, ordinal AIDS, and cluster differences scaling - and two techniques of our invention - hierarchical MDS and sparse region scaling. The results suggest that each technique except ordinal MDS can significantly improve the representation of small dissimilarities between program executions and that hierarchical MDS and sparse region scaling perform best overall","2332-6549","0-7695-2482-6","10.1109/ISSRE.2005.45","","https://ieeexplore.ieee.org/stamp/stamp.jsp?arnumber=1544745","","Multidimensional systems;Displays;Software testing;Euclidean distance;Data visualization;Scattering;Application software;Software tools;Maintenance;Software engineering","","7","","16","IEEE","5 Dec 2005","","","IEEE","IEEE Conferences"
"VulDetector: Detecting Vulnerabilities Using Weighted Feature Graph Comparison","L. Cui; Z. Hao; Y. Jiao; H. Fei; X. Yun","Chinese Academy of Science, Institute of Information Engineering, Beijing, China; Chinese Academy of Science, Institute of Information Engineering, Beijing, China; Chinese Academy of Science, Institute of Information Engineering, Beijing, China; Chinese Academy of Science, Institute of Information Engineering, Beijing, China; Chinese Academy of Science, Institute of Information Engineering, Beijing, China",IEEE Transactions on Information Forensics and Security,"27 Jan 2021","2021","16","","2004","2017","Code similarity is one promising approach to detect vulnerabilities hidden in software programs. However, due to the complexity and diversity of source code, current methods suffer low accuracy, high false negative and poor performance, especially in analyzing a large program. In this paper, we propose to tackle these problems by presenting VulDetector, a static-analysis tool to detect C/C++ vulnerabilities based on graph comparison at the granularity of function. At the key of VulDetector is a weighted feature graph (WFG) model which characterizes function with a small yet semantically rich graph. It first pinpoints vulnerability-sensitive keywords to slice the control flow graph of a function, thereby reducing the graph size without compromising security-related semantics. Then, each sliced subgraph is characterized using WFG, which provides both syntactic and semantic features in varying degrees of security. As for graph comparison, we take full usage of vulnerability graph and patch graph to improve accuracy. In addition, we propose two optimization methods based on analysis of vulnerabilities. We have implemented VulDetector to automatically detect vulnerabilities in software programs with known vulnerabilities. The experimental results prove the effectiveness and efficiency of VulDetector.","1556-6021","","10.1109/TIFS.2020.3047756","National Natural Science Foundation of China(grant numbers:61972392,62072453); Youth Innovation Promotion Association of the Chinese Academy of Sciences(grant numbers:2020164); ","https://ieeexplore.ieee.org/stamp/stamp.jsp?arnumber=9309254","Vulnerability detection;code similarity;weighted feature graph","Syntactics;Software;Testing;Semantics;Security;Optimization methods;Lenses","","30","","53","IEEE","28 Dec 2020","","","IEEE","IEEE Journals"
"Research on Experimental Process Monitoring Method of Closed Experimental Equipment Based on Image Recognition Technology","W. Tong; Z. Shen; X. Chu; L. Pang; X. Wang","Laboratory for Space Environment and Physical Sciences, Harbin Institute of Technology, Harbin, China; School of Electrical Engineering and Automation, Harbin Institute of Technology, Harbin, China; School of Electrical Engineering and Automation, Harbin Institute of Technology, Harbin, China; Laboratory for Space Environment and Physical Sciences, Harbin Institute of Technology, Harbin, China; Laboratory for Space Environment and Physical Sciences, Harbin Institute of Technology, Harbin, China","2021 International Conference on Communications, Information System and Computer Engineering (CISCE)","9 Jun 2021","2021","","","442","446","Compared with open experimental equipment, closed experimental equipment that uses computer experimental software with a private protocol to complete the experimental process has higher security and is widely used in the fields such as space environment experiment simulation. This paper takes the private protocol computer experiment software of the closed experimental equipment as the research object, while proposes a cooperative monitoring strategy for the experiment process. By combining the image structure similarity comparison algorithm with dynamic event monitoring, this method realizes the monitoring of the experimental process of a closed experimental equipment with a proprietary protocol computer experimental software. The test results of this method show that the experimental process monitoring method proposed in this paper has better performance and higher accuracy and reliability.","","978-1-6654-0352-8","10.1109/CISCE52179.2021.9445875","","https://ieeexplore.ieee.org/stamp/stamp.jsp?arnumber=9445875","Image recognition technology;Closed experimental equipment;Structural similarity;Collaborative monitoring strategy","Process monitoring;Protocols;Image recognition;Heuristic algorithms;Software algorithms;Reliability engineering;Software","","","","11","IEEE","9 Jun 2021","","","IEEE","IEEE Conferences"
"Big Data Critical Computing Based on the Similarity-Difference Metric","A. V. Hacimahmud; L. Shapa; V. Hahanov; A. Mishchenko; O. Shevchenko; S. Chumachenko; E. Litvinova","Computer Engineering Department, Azerbaijan State Oil and Industry University, Baku, Azerbaijan; Design Automation Department, Kharkov National University of Radio Electronics, Kharkov, Ukraine; Design Automation Department, Kharkov National University of Radio Electronics, Kharkov, Ukraine; Design Automation Department, Kharkov National University of Radioelectronics, Kharkov, Ukraine, USA; Design Automation Department, Kharkov National University of Radio Electronics, Kharkov, Ukraine; Design Automation Department, Kharkov National University of Radio Electronics, Kharkov, Ukraine; Design Automation Department, Kharkov National University of Radio Electronics, Kharkov, Ukraine",2020 IEEE East-West Design & Test Symposium (EWDTS),"15 Oct 2020","2020","","","1","6","Models, methods and algorithms for cyber-social computing are proposed that use the similarity-difference metric of unitary coded information for processing big data in order to generate adequate actuator signals for controlling cyber-social critical systems. A set-theoretic method for data retrieval has being developed based on the similarity-difference of the frequency parameters of primitive elements, which makes it possible to determine the similarity of objects, the strategy of transforming one object into another, as well as to identify the level of common interests, conflict. The definitions of the fundamental concepts in the field of computing are given on the basis of metric relations between interacting processes and phenomena. A software application is proposed for calculating the similarity-differences of objects based on the formation of frequency vectors of two sets of primitive data. A high level of correlation between the results of the application and the well-known system for determining plagiarism is shown.","2472-761X","978-1-7281-9899-6","10.1109/EWDTS50664.2020.9225110","","https://ieeexplore.ieee.org/stamp/stamp.jsp?arnumber=9225110","computing;cyber social computing;decision-making;unitary data codes;similarity-difference;big data analysis;plagiarism","Measurement;Monitoring;Process control;Design automation;Cloud computing;Big Data;Transforms","","","","9","IEEE","15 Oct 2020","","","IEEE","IEEE Conferences"
"Duplicate short text detection based on Word2vec","J. Gao; Y. He; X. Zhang; Y. Xia","School of Software Engineering, Beijing University of Posts and Telecommunications, Beijing, China; School of Software, Tsinghua University, Beijing, China; School of Software Engineering, Beijing University of Posts and Telecommunications, Beijing, China; School of Software Engineering, Beijing University of Posts and Telecommunications, Beijing, China",2017 8th IEEE International Conference on Software Engineering and Service Science (ICSESS),"23 Apr 2018","2017","","","33","37","In modern life, people own new social relationship, watch news, create e-commerce transactions and have entertainment online. Light blogs and short comments become more and more popular. The traditional duplicate long text detection algorithms are hard to be applied in the current situations, so more effective duplicate detection algorithm for short text is needed. Based on the bag-of-words model Word2vec, this paper proposes a kind of duplicate detection algorithm with semantic embedded for short text. Words are embedded into vectors which are as input elements in Simhash algorithm to acquire 64 bits sequence, then compare two sequences with Hamming distances and return result filtered by preset threshold value. Subsequently, a more superior improvement is proposed where we add weighted idea into. The results are compared with the unweighted Word2vec method and the traditional TF-IDF method. Experiments are carried out on the SICK corpus, and its result shows that the weighted Word2vec method achieves higher accuracy and recall rate.","2327-0594","978-1-5386-0497-7","10.1109/ICSESS.2017.8342858","","https://ieeexplore.ieee.org/stamp/stamp.jsp?arnumber=8342858","short text;duplicate detection;TF-IDF;Word2vec;semantic similarity;Simhash","Detection algorithms;Semantics;Entertainment industry;Blogs","","12","","23","IEEE","23 Apr 2018","","","IEEE","IEEE Conferences"
"Self-Similarity Based Classification of 3D Surface Textures","L. Qi; L. Zhang; J. Dong; Z. Yu; A. Yang","Computer Science Department, Ocean University of China, Qingdao, China; Computer Science Department, Ocean University of China, Qingdao, China; Computer Science Department, Ocean University of China, Qingdao, China; Administrative Office of Qingdao Software Technology Park, Qingdao, China; School of Information Science and Engineering, Ocean University of China",2008 Congress on Image and Signal Processing,"16 Jul 2008","2008","2","","402","406","This paper presents a novel 3D surface texture classification method based on self-similarity maps which are calculated directly from raw captured texture images. 3D surface textures have special properties for they are sensitive to illumination and view conditions. Some previous classification methods which are illumination invariant or rotation invariant have shown to be effective to this particularity, but most of them are model-based. We introduce a new approach to classify 3D surface texture image sets by automatically extracted self-similarity maps. Feature vectors are then generated from responses to a filter bank of the self-similarity maps. Classification is achieved by comparing the L2 distance between training and testing feature vectors. The experiment results show our approach achieves an accuracy of 95%.","","978-0-7695-3119-9","10.1109/CISP.2008.294","","https://ieeexplore.ieee.org/stamp/stamp.jsp?arnumber=4566335","self-similarity;3D surface texture;classification","Surface texture;Sea surface;Lighting;Rough surfaces;Surface roughness;Reflectivity;Oceans;Filter bank;Testing;Humans","","3","","10","IEEE","16 Jul 2008","","","IEEE","IEEE Conferences"
"Semantic Similarity-based Visual Reasoning without Language Information","C. Choi; H. Lim; H. Jang; J. Park; E. Kim; K. Lim","Department of Computer Engineering, Hanbat National University, Daejeon, South Korea; Department of Computer Engineering, Hanbat National University, Daejeon, South Korea; Surromind Co., Ltd., Seoul, South Korea; Euclidsoft Co., Ltd., Daejeon, South Korea; Department of AI Software, Hanbat National University, Daejeon, South Korea; Department of Computer Engineering, Hanbat National University, Daejeon, South Korea",2023 International Conference on Artificial Intelligence in Information and Communication (ICAIIC),"23 Mar 2023","2023","","","107","111","In this research, we propose new training data for the visual reasoning task based on semantic similarity and proposed a deep learning model that utilizes the data. The first contribution of this study is the construction of training data. Based on a total of 40 object attributes, we created a visual inference problem using only image data. As a result, a total of 6,000 datasets were built to create training and test data. We also propose a visual inference model as the second contribution of this work. The inference model shown in this study was evaluated for two tasks using ResNet50 and Vision Transformer, respectively. Based on the experimental evaluation results, we investigated the suitable pre-trained model for both single-choice binary reasoning and multiple-selection reasoning, respectively.","2831-6983","978-1-6654-5645-6","10.1109/ICAIIC57133.2023.10067104","National Information Society Agency (NIA); Ministry of Education(grant numbers:2021RIS-004,2021RIFIAI063474); ","https://ieeexplore.ieee.org/stamp/stamp.jsp?arnumber=10067104","Visual Reasoning;Inference;Image similarity;Deep Learning","Training;Deep learning;Visualization;Semantics;Training data;Transformers;Cognition","","","","13","IEEE","23 Mar 2023","","","IEEE","IEEE Conferences"
"Fuzzing Methods Recommendation Based on Feature Vectors","C. Zhang; J. Chen","School of Computer Science & Communication Engineering, Jiangsu University, Zhenjiang, China; School of Computer Science & Communication Engineering, Jiangsu University, Zhenjiang, China",2021 36th IEEE/ACM International Conference on Automated Software Engineering (ASE),"20 Jan 2022","2021","","","1079","1081","Fuzzing is a technique that aims to detect vulnerabilities or exceptions through unexpected input and has found tremendous recent interest in both academia and industry. Although these fuzzing methods have great advantages in the field of vulnerability detection, they also have their own disadvantages in the face of different target programs. It is obviously impractical for a fuzzing test method to adapt to all the target programs. Therefore, we study how to select the appropriate fuzzing methods for different target programs. Specifically, we first analyze the program, and then extract the feature vectors of the target program to get the information of the program, such as syntax, context and so on. Next, we build a matching model to match the similarity of target program and the fuzzing algorithm to select the fuzzing algorithm with higher matching degree. Through our matching model, we get a more suitable fuzzing algorithm to improve the detection efficiency, precision, recall, F-measure, and other statistical measures.","2643-1572","978-1-6654-0337-5","10.1109/ASE51524.2021.9678630","National Natural Science Foundation of China; China Postdoctoral Science Foundation; Postdoctoral Science Foundation of Jiangsu Province; ","https://ieeexplore.ieee.org/stamp/stamp.jsp?arnumber=9678630","Fuzzing;Vulnerability detection;Feature vector;Similarity","Industries;Software algorithms;Fuzzing;Syntactics;Feature extraction;Data mining;Faces","","","","15","IEEE","20 Jan 2022","","","IEEE","IEEE Conferences"
"Enhancing Population Diversity for Genetic Algorithms","F. Huang; N. Xiao; Q. Chen","Faculty of Software, Fujian Normal University, Fuzhou, China; School of Computer Science and Engineering, South China University of Technology, Guangzhou, China; School of Computer Science and Engineering, South China University of Technology, Guangzhou, China",2009 Fifth International Conference on Natural Computation,"28 Dec 2009","2009","4","","222","226","The premature convergence may lead the genetic algorithms (GAs) to a local optimum but not a global one. Maintaining the population diversity in GAs, or minimize its loss, may alleviate this problem to a certain extent. A novel selector based on eugenics (EBSelector) has been proposed to faciliate effective selection of individuals to perform crossover, inspired by the eugenic theory about how to make familial disease less happen and to produce high-quality offspring. Demonstrated through a suite of benchmark test functions, the proposed algorithm is shown competitive performance with improved convergence speed.","2157-9563","978-0-7695-3736-8","10.1109/ICNC.2009.560","","https://ieeexplore.ieee.org/stamp/stamp.jsp?arnumber=5365430","genetic algorithms;population diversity;eugenics theory","Genetic algorithms;Diseases;Time measurement;Demography;Evolution (biology);Benchmark testing;Convergence;Biology computing;Evolutionary computation;Frequency diversity","","","","13","IEEE","28 Dec 2009","","","IEEE","IEEE Conferences"
"Stopping Memory Disclosures via Diversification and Replicated Execution","K. Lu; M. Xu; C. Song; T. Kim; W. Lee","University of Minnesota, Minneapolis, MN, USA; Georgia Institute of Technology, Atlanta, GA, USA; University of California, Riverside, CA, USA; Georgia Institute of Technology, Atlanta, GA, USA; Georgia Institute of Technology, Atlanta, GA, USA",IEEE Transactions on Dependable and Secure Computing,"7 Jan 2021","2021","18","1","160","173","With the wide deployment of security mechanisms such as Address Space Layout Randomization (ASLR), memory disclosures have become a prerequisite for critical memory-corruption attacks (e.g., code-reuse attack)-adversaries are forced to exploit memory disclosures to circumvent ASLR as the first step. As a result, the security threats of memory disclosures are now significantly aggravated-they break not only data confidentiality but also the effectiveness of security mechanisms. In this paper, we propose a general detection methodology and develop a system to stop memory disclosures. We observe that memory disclosures are not root causes but rather consequences of a variety of hard-to-detect program errors such as memory corruption and uninitialized read. We thus propose a replicated execution-based methodology to generally detect memory disclosures, regardless of their causes. We realize this methodology with Buddy: By seamlessly maintaining two identical running instances of a target program and diversifying only its target data, Buddy can accurately detects memory disclosures of the data, as doing so will result in the two instances outputting different values. Extensive evaluation results show that Buddy is reliable and efficient while stopping real memory disclosures such as the Heartbleed leak.","1941-0018","","10.1109/TDSC.2018.2878234","","https://ieeexplore.ieee.org/stamp/stamp.jsp?arnumber=8510822","Memory disclosure;diversification;replicated execution;N-version system;code-reuse attack","Synchronization;Security;Kernel;Benchmark testing;Web servers;Memory management;Layout","","15","","56","IEEE","26 Oct 2018","","","IEEE","IEEE Journals"
"Balancing Convergence and Diversity in Multiobjective Immune Algorithm","L. Li; W. Lin; Q. Lin; Z. Ming","College of Computer Science and Software Engineering, Shenzhen University, Shenzhen, China; College of Computer Science and Software Engineering, Shenzhen University, Shenzhen, China; College of Computer Science and Software Engineering, Shenzhen University, Shenzhen, China; College of Computer Science and Software Engineering, Shenzhen University, Shenzhen, China",2020 12th International Conference on Advanced Computational Intelligence (ICACI),"26 Aug 2020","2020","","","102","109","Recently, multiobjective immune algorithms (MOIAs) become popular, which are designed for multiobjective optimization problems (MOPs). However, most existing MOIAs put more attention on maintaining diversity as the used clonal selection strategy will allocate more cloning for the sparse areas, which may hamper the convergence to speed to the optimal Pareto front, especially for some complicated MOPs. To alleviate the phenomenon mentioned above, we propose a dynamic mechanism into traditional MOIAs in this paper, aiming to balance convergence and diversity, called BCD-MOIA. First, MOP will be decomposed into several single subproblems by decomposition method, and then these subproblems will be optimized simultaneously. Second, we propose a novel measure metric instead of the crowding distance to assign the clone number for each solution, which includes two main parts. The first part focuses on the diversity performance, i.e., the perpendicular distance between solution and its associated weight vectors. The second part uses the aggregated function values quantified by the decomposition method, which is more efficient for accelerating the convergence speed and maintaining diversity as well. Moreover, a dynamic mechanism is performed during the whole evolutionary process, focusing on diversity and convergence at different stages. By this way, our proposed algorithm can tradeoff the performance on convergence and diversity dynamically. The effectiveness of our proposed algorithm BCD-MOIA is validated by comparing with three competitive MOIAs and three multi-objective evolutionary algorithms for tackling two sets of complicated problems.","2573-3311","978-1-7281-4248-7","10.1109/ICACI49185.2020.9177787","","https://ieeexplore.ieee.org/stamp/stamp.jsp?arnumber=9177787","immune algorithnb multiobjective optimization problems;convergence and diversity","Cloning;Convergence;Sociology;Statistics;Optimization;Heuristic algorithms;Software algorithms","","2","","26","IEEE","26 Aug 2020","","","IEEE","IEEE Conferences"
