"Variant: a malware similarity testing framework","J. Upchurch; X. Zhou","Department of Computer Science, University of Colorado, Colorado Springs, USA; Department of Computer Science, University of Colorado, Colorado Springs, USA",2015 10th International Conference on Malicious and Unwanted Software (MALWARE),"25 Feb 2016","2015","","","31","39","This paper describes Variant, a testing framework for projects attempting to locate variants of malware families through similarity testing. The framework is a series of tests and data standards to evaluate recall and precision in tools that attempt to statically measure similarity in implementation of compiled software, specifically in determining code reuse in compiled software to identify malware variants. The paper offers a malware test dataset that has been manually analyzed to provide a gold standard dataset to be used in current and future malware variant detection works. This set provides a much needed resource in standardizing results across numerous works that have, so far, been tested against datasets that are either not reproducible, algorithmically derived, or both. The framework and dataset provided in this paper are used to test several malware detection approaches published in academic works or used in industry. Finally, the paper brings alignment of testing and reporting methods used in malware variant detection to those used in other statical testing methods used in industry and academia.","","978-1-5090-0319-8","10.1109/MALWARE.2015.7413682","","https://ieeexplore.ieee.org/stamp/stamp.jsp?arnumber=7413682","","Malware;Testing;Standards;Software;Algorithm design and analysis;Gold;Industries","","15","","19","IEEE","25 Feb 2016","","","IEEE","IEEE Conferences"
"Efficiently represent diverse system field usage in reliability testing","P. J. M. Sonnemans; A. Balasubramanian; K. Kevrekedis; M. J. Newby","City University of London, UK; Eindhovan University of Technology, Netherlands; Eindhovan University of Technology, Netherlands; Eindhovan University of Technology, Netherlands",2008 Annual Reliability and Maintainability Symposium,"15 May 2009","2008","","","132","136","This paper addresses the problem how to represent diverse field usage of professional systems in an efficient way, so that field usage can be incorporated in reliability tests. With diverse we mean the variability in system use in the field. Operational Profiles are constructed from system field data to represent system field use. A clustering technique is introduced and applied in a strategic way to reduce the diversity in describing diverse system use in the field. In this way testing effort could be reduced by a factor 87 while maintaining 70 % similarity with the original system field data.","0149-144X","978-1-4244-1460-4","10.1109/RAMS.2008.4925783","","https://ieeexplore.ieee.org/stamp/stamp.jsp?arnumber=4925783","reliability;testing;system use;operational profile;clustering;grouping;field performance","System testing;Biomedical imaging;Medical diagnostic imaging;Hospitals;Software testing;Maintenance;Reliability;Automotive engineering;Manufacturing;Medical services","","1","","10","IEEE","15 May 2009","","","IEEE","IEEE Conferences"
"An Efficient Automated Test Data Generation Method","H. Cui; L. Chen; B. Zhu; H. Kuang","Huazhong Normal Univ., Wuhan, China; Huazhong Normal Univ., Wuhan, China; Huazhong Normal Univ., Wuhan, China; Huazhong Normal Univ., Wuhan, China",2010 International Conference on Measuring Technology and Mechatronics Automation,"6 May 2010","2010","1","","453","456","How to shorten the time for test data generation is concerned about the main points of the current era. For this purpose, this paper brought forward an efficient automated test data generation method. In this paper first elaborated the basic particle swarm optimization algorithm and the improved particle swarm optimization algorithm, and as a search strategy, and then in this paper focused on the path of trajectory similarity calculation method. Experiments show that their combination of two methods can more efficiently generate test data.","2157-1481","978-1-4244-5739-7","10.1109/ICMTMA.2010.556","","https://ieeexplore.ieee.org/stamp/stamp.jsp?arnumber=5459797","Test data;particle swarm optimization algorithm;improved PSO;predicate function;path similarity calculation method","Automatic testing;Particle swarm optimization;Software testing;Genetic algorithms;Software quality;Programming;Costs;Current measurement;Time measurement;Mechatronics","","5","","8","IEEE","6 May 2010","","","IEEE","IEEE Conferences"
"Transcend Adversarial Examples: Diversified Adversarial Attacks to Test Deep Learning Model","W. Kong","National Key Laboratory of Science and Technology on Information System Security, Beijing, China",2023 IEEE 41st International Conference on Computer Design (ICCD),"22 Dec 2023","2023","","","13","20","Existing optimized adversarial attacks rely on the ability to search for perturbation within lp norm while keeping maximized loss for highly non-convex loss functions. Random initialization perturbation and the steepest gradient direction strategy are efficient techniques to prevent falling into local optima but compromise the capability of diversity exploration. Therefore, we introduce the Diversity-Driven Adversarial Attack (DAA), which incorporates Output Diversity Strategy (ODS) and diverse initialization gradient direction into the optimized adversarial attack algorithm, aiming to refine the inherent properties of the adversarial examples (AEs). More specifically, we design a diversity-promoting regularizer to penalize the insignificant distance between initialization gradient directions based on the version of ODS. Extensive experiments demonstrate that DAA can efficiently improve existing coverage criteria without sacrificing the performance of attack success rate, which implies that DAA can implicitly explore more internal model logic of DL model.","2576-6996","979-8-3503-4291-8","10.1109/ICCD58817.2023.00013","","https://ieeexplore.ieee.org/stamp/stamp.jsp?arnumber=10360997","Adversarial Attack;Diversity;Robustness and Security;Test Deep Learning Model","Deep learning;Measurement;Perturbation methods;Computational modeling;Computer security;Testing","","","","31","IEEE","22 Dec 2023","","","IEEE","IEEE Conferences"
"Fuzzy similarity-based data fusion algorithm and its application to engine testing","Xiong Li; Zongchang Xu; Zhiming Dong","Department of Command and Administration, Academy of Armored Forces Engineering, Beijing, China; Department of Command and Administration, Academy of Technical Support Engineering, Beijing, China; Department of Command and Administration, Academy of Armored Forces Engineering, Beijing, China",2005 IEEE International Conference on Granular Computing,"5 Dec 2005","2005","2","","516","519 Vol. 2","According to the requirements of multisensor data fusion in real-time engine testing, a novel, fuzzy similarity-based data fusion algorithm is given in this paper. Based on fuzzy set theory, it calculates the fuzzy similarity between a certain sensor's measurement values and the multiple sensors' objective prediction values to determine the importance weigh of each sensor, and realize the multisensor testing parameter data fusion. According to the algorithm theory, its application software is also designed in the paper. The applied example proves that the algorithm can give priority to the high-stability and high-reliability sensors and it is laconic, efficient and feasible to real-time circumstance measure and data processing in engine condition monitoring and measurement.","","0-7803-9017-2","10.1109/GRC.2005.1547345","","https://ieeexplore.ieee.org/stamp/stamp.jsp?arnumber=1547345","","Engines;Testing;Fuzzy set theory;Sensor fusion;Software algorithms;Application software;Software design;Algorithm design and analysis;Data processing;Condition monitoring","","1","1","14","IEEE","5 Dec 2005","","","IEEE","IEEE Conferences"
"TAF: a Tool for Diverse and Constrained Test Case Generation","C. Robert; J. Guiochet; H. Waeselynck; L. V. Sartori","LAAS-CNRS, Université de Toulouse, CNRS, Toulouse, France; LAAS-CNRS, Université de Toulouse, CNRS, Toulouse, France; LAAS-CNRS, Université de Toulouse, CNRS, Toulouse, France; LAAS-CNRS, Université de Toulouse, CNRS, Toulouse, France","2021 IEEE 21st International Conference on Software Quality, Reliability and Security (QRS)","10 Mar 2022","2021","","","311","321","The generation of test cases may have to accommodate size-varying data structures and semantic constraints between the data elements. This often requires the development of custom generators. In this paper, we introduce a novel generic tool to generate constrained and diverse test cases from a data model. First, the user defines the model using an XML-based domain-specific language. Then TAF generates diverse test cases by combining random sampling with the use of an SMT solver. The capabilities of the tool are demonstrated by four examples of models coming from various application domains: virtual crop fields for testing an agriculture robot, bitmap images with a graduated background, a population of taxpayers in a tax management system, and tree structures of diverse sizes and heights. We show how TAF performs in terms of data diversity and execution time. We also provide some comparison results with an UML-based tool using SMT solving.","2693-9177","978-1-6654-5813-9","10.1109/QRS54544.2021.00042","","https://ieeexplore.ieee.org/stamp/stamp.jsp?arnumber=9724803","test;test input generation;fuzzing;autonomous robots;simulation","Three-dimensional displays;Unified modeling language;Diversity reception;Data structures;Data models;Test pattern generators;Usability","","6","","26","IEEE","10 Mar 2022","","","IEEE","IEEE Conferences"
"Fast Test Generation for Structurally Similar Circuits","J. Joe; N. Mukherjee; I. Pomeranz; J. Rajski","School of Electrical & Computer Engg., Purdue University, W. Lafayette, IN, USA; Siemens Digital Industries Software, Wilsonville, OR, USA; School of Electrical & Computer Engg., Purdue University, W. Lafayette, IN, USA; Siemens Digital Industries Software, Wilsonville, OR, USA",2022 IEEE 40th VLSI Test Symposium (VTS),"15 Jun 2022","2022","","","1","7","This paper describes a fast test generation process for digital circuits that exhibit extensive structural similarity. The property of structural similarity can be seen in circuits that are subjected to engineering change order (ECO), circuits that are modified during place and route, circuits subjected to retiming, and circuits with multiple similar cores. The goal of the paper is to determine the testability of a circuit (circuit2) given a test set for a structurally similar circuit (circuit1). This is achieved by transforming a test set generated for circuit1 into a test set for circuit2 as efficiently as possible, without repeating the entire test generation process. The process described in the paper starts with a structural analysis of circuit1 and circuit2 to obtain a mapping between their inputs and outputs. The mapping is used for transforming test patterns from circuit1 into test patterns for circuit2. The experiments conducted on industrial designs show an average of more than 10-fold reduction in runtime, compared with running the entire test generation process for circuit2.","2375-1053","978-1-6654-1060-1","10.1109/VTS52500.2021.9794232","","https://ieeexplore.ieee.org/stamp/stamp.jsp?arnumber=9794232","","Runtime;Very large scale integration;Test pattern generators;Digital circuits","","5","","25","IEEE","15 Jun 2022","","","IEEE","IEEE Conferences"
"An open-source software package to assess similarity measures that compare intuitionistic fuzzy sets","M. Loor; G. De Tre","Dept. of Electrical and Computer Engineering, ESPOL University, Guayaquil, Ecuador; Ghent University Dept. of Telecommunications and Information Processing, Ghent, Belgium",2017 IEEE International Conference on Fuzzy Systems (FUZZ-IEEE),"24 Aug 2017","2017","","","1","6","Since intuitionistic fuzzy sets (IFSs) have been applied to solve problems in topics like decision-making or pattern recognition, the study of similarity measures aiming to compare this kind of fuzzy sets has become a challenging research subject. When proposed, a similarity measure is usually tested to demonstrate its properties and advantages over the others. However, those tests are occasionally performed using a small number of examples that do not allow a researcher or practitioner to detect potential drawbacks. In this paper, an open-source software package whereby a researcher can empirically assess several (configurations of) similarity measures while comparing IFSs that characterize experience-based evaluations is proposed and presented. By means of the proposed package, one can (1) build a large number of IFSs according to different learning scenarios, (2) compare those IFSs using existing or novel similarity measures, and (3) generate a comprehensive report about how each similarity measure reflects a perceived similarity. Reports generated by the package show that only a few of the existing similarity measures reflect properly a perceived similarity when IFSs resulting from opposite learning scenarios are compared to each other.","1558-4739","978-1-5090-6034-4","10.1109/FUZZ-IEEE.2017.8015689","","https://ieeexplore.ieee.org/stamp/stamp.jsp?arnumber=8015689","","Fuzzy sets;Software packages;Open source software;Software measurement;Decision making;Pattern recognition;Current measurement","","3","","27","IEEE","24 Aug 2017","","","IEEE","IEEE Conferences"
"Applying Binary Code Similarity Detection on Acceleration Processor","G. Yin; Y. Tang; W. Xie; Z. Luo; Y. Wang","College of Computer, National University of Defense Technology, Changsha, China; College of Computer, National University of Defense Technology, Changsha, China; College of Computer, National University of Defense Technology, Changsha, China; College of Computer, National University of Defense Technology, Changsha, China; College of Computer, National University of Defense Technology, Changsha, China",2023 4th International Conference on Computer Engineering and Intelligent Control (ICCEIC),"13 Feb 2024","2023","","","454","459","Binary code similarity detection, as an integral part of network security, has remained a hot spot in the research fields of intellectual property protection, vulnerability detection, patch analysis, and malicious software detection. It carries significant usability value. With the rapid development of deep learning and neural network technologies, new algorithms and thoughts have been introduced into the research of binary code similarity detection, achieving breakthrough progress. MT-3000, a heterogeneous multi-zone acceleration processor, which is entirely designed and implemented by National University of Defense Technology, possesses powerful computing performance. In this paper, based on the latest deep learning theory and using the domestically produced and controllable high-performance MT-3000 acceleration processor for relevant tests and researches on the binary code similarity detection, proposes relevant conclusions and suggestions.","","979-8-3503-0887-7","10.1109/ICCEIC60201.2023.10426711","","https://ieeexplore.ieee.org/stamp/stamp.jsp?arnumber=10426711","code similarity detection;deep learning;MT-3000;Euclidean distance","Deep learning;Ecosystems;Software algorithms;Process control;Binary codes;Life estimation;Usability","","","","10","IEEE","13 Feb 2024","","","IEEE","IEEE Conferences"
"Evaluating similarity measures for software decompositions","Zhihua Wen; V. Tzerpos","York University, Toronto, ONT, Canada; York University, Toronto, ONT, Canada","20th IEEE International Conference on Software Maintenance, 2004. Proceedings.","22 Nov 2004","2004","","","368","377","One of the central questions that a similarity measure for software decompositions has to address is whether to consider discrepancies in terms of the nodes of a particular decomposition, or assess similarity based on differences in clustering the edges of the system's dependency graph. We argue that considering nodes or edges in isolation is too one-sided. We outline shortcomings of previous approaches, and introduce the first dissimilarity measure that takes both nodes and edges into account. We also present experiments on real and synthetic data sets that illustrate the differences between various measures.","1063-6773","0-7695-2213-0","10.1109/ICSM.2004.1357822","","https://ieeexplore.ieee.org/stamp/stamp.jsp?arnumber=1357822","","Software measurement;Software systems;Software maintenance;Clustering algorithms;Software algorithms;Particle measurements;System testing;Benchmark testing;Information retrieval","","12","","16","IEEE","22 Nov 2004","","","IEEE","IEEE Conferences"
"High Performance Data Mining Algorithms and Similarity Models Research","S. Xue; H. Wang; T. Ran","Computer and Software Institute, Nanjing University of Information Science and Technology, Nanjing, Jiangsu, China; School of Computer Science and Technology, Wuhan University of Technology, Wuhan, Hubei, China; School of Computer Science and Technology, Wuhan University of Technology, Wuhan, Hubei, China",2008 International Conference on Computer Science and Software Engineering,"22 Dec 2008","2008","4","","411","414","For the complex data of multilevel and large volume distributed in different regions, how to seek and find both be interested and useful information is what scientists are devoted to. Existing efficient method of research is an association rule mining of distributed database system. This paper introduced the distributed association rule mining algorithm. By analyzing the Aproiri algorithm, we have proposed Fast Distributed Mining of Association Rule algorithm and Similarity model. The test results show it can effectively improve the mining accuracy rate.","","978-0-7695-3336-0","10.1109/CSSE.2008.1359","","https://ieeexplore.ieee.org/stamp/stamp.jsp?arnumber=4722646","data mining;association rule;algorithm;data resource heterogeneous;similarit","Data mining;Association rules;Itemsets;Computer science;Database systems;Transaction databases;Distributed databases;Distributed decision making;Software engineering;Software algorithms","","","","5","IEEE","22 Dec 2008","","","IEEE","IEEE Conferences"
"A design diversity metric and reliability analysis for redundant systems","S. Mitra; N. R. Saxena; E. J. McCluskey","Center for Reliable Computing, Departments of Electrical Engineering and Computer Science, University of Stanford, Stanford, CA, USA; Center for Reliable Computing, Departments of Electrical Engineering and Computer Science, University of Stanford, Stanford, CA, USA; Center for Reliable Computing, Departments of Electrical Engineering and Computer Science, University of Stanford, Stanford, CA, USA",International Test Conference 1999. Proceedings (IEEE Cat. No.99CH37034),"6 Aug 2002","1999","","","662","671","Design diversity has long been used to protect redundant systems against common-mode failures. The conventional notion of diversity relies on ""independent"" generation of ""different"" implementations. This concept is qualitative and does not provide a basis to compare the reliabilities of two diverse systems. In this paper, for the first time, we present a metric to quantify diversity among several designs. Based on this metric, we derive analytical reliability models that show a simple relationship between design diversity, system failure rate, and mission time. In addition, we present simulation results to demonstrate the effectiveness of design diversity in Duplex and Triple Modular Redundant (TMR) systems. For independent multiple-module failures, we show that, mere use of different implementations does not always guarantee higher reliability compared to redundant systems with identical implementations-it is important to analyze the reliability of redundant systems using our metric. For common-mode failures and design faults, there is a significant gain in using different implementations-however, as our analysis shows, the gain diminishes as the mission time increases. Our simulation results also demonstrate the usefulness of diversity for enhancing the self-testing properties of redundant systems.","1089-3539","0-7803-5753-1","10.1109/TEST.1999.805794","","https://ieeexplore.ieee.org/stamp/stamp.jsp?arnumber=805794","","Failure analysis;Circuit faults;Hardware;Field programmable gate arrays;Protection;Redundancy;Very large scale integration;Software systems;Analytical models;Electromagnetic interference","","33","1","28","IEEE","6 Aug 2002","","","IEEE","IEEE Conferences"
"Preparing Text Reports from Web Pages Employing Similarity Tests","J. G. Ramos; J. C. Solorio; L. Campoy; S. Ruiz; N. Jasso","Instituto Tecnológico de La Piedad, Av. Tecnológico, México, CP; Instituto Tecnológico de La Piedad, Av. Tecnológico, México, CP; Instituto Tecnológico de La Piedad, Av. Tecnológico, México, CP; Instituto Tecnológico de La Piedad, Av. Tecnológico, México, CP; Instituto Tecnológico de La Piedad, Av. Tecnológico, México, CP",2013 Mexican International Conference on Computer Science,"12 Dec 2013","2013","","","13","19","The World Wide Web is the main source of information for many organizations and common users. However, the analysis and selection of the web content is still an arduous manual task in many cases. When a web query is sent towards a web search engine, a list of URLs is received, frequently ordered by popularity (such as Google's PageRank algorithm). Then, the user must read and analyze each URL in order to find out the convenient information. In this work a method that automatically constructs a text report induced by a web query from a set of URLs is presented. The method extracts text slices (excerpts) from web pages considering the most similar text w.r.t. a web query as slicing criterion. A slice is composed by document object model (DOM) nodes, whereas similarity is calculated using standard techniques employed in natural language processing.","2332-5712","978-0-7695-5087-9","10.1109/ENC.2013.8","","https://ieeexplore.ieee.org/stamp/stamp.jsp?arnumber=6679814","information retrieval;slicing;similarity;summarization","Web pages;Vectors;Software tools;Standards;Natural language processing;Google","","1","","18","IEEE","12 Dec 2013","","","IEEE","IEEE Conferences"
"An Industrial Investigation of Similarity Measures for Model-Based Test Case Selection","H. Hemmati; L. Briand","Simula Research Laboratory and Department of Informatics, University of Oslo, Norway; Simula Research Laboratory and Department of Informatics, University of Oslo, Norway",2010 IEEE 21st International Symposium on Software Reliability Engineering,"11 Nov 2010","2010","","","141","150","Applying model-based testing (MBT) in practice requires practical solutions for scaling up to large industrial systems. One challenge that we have faced while applying MBT was the generation of test suites that were too large to be practical, even for simple coverage criteria. The goal of test case selection techniques is to select a subset of the generated test suite that satisfies resource constraints while yielding a maximum fault detection rate. One interesting heuristic is to choose the most diverse test cases based on a pre-defined similarity measure. In this paper, we investigate and compare possible similarity functions to support similarity-based test selection in the context of state machine testing, which is the most common form of MBT. We apply the proposed similarity measures and a selection strategy based on genetic algorithms to an industrial software system. We compare their fault detection rate based on actual faults. The results show that applying Jaccard Index on test cases represented as a set of trigger-guards is the most cost-effective similarity measure. We also discuss the overall benefits of our test selection approach in terms of test execution savings.","2332-6549","978-1-4244-9056-1","10.1109/ISSRE.2010.9","","https://ieeexplore.ieee.org/stamp/stamp.jsp?arnumber=5635133","Test case selection;model-based testing;UML state machine;similarity measure;genetic algorithms","Unified modeling language;Encoding;Testing;Gallium;Context;Fault detection;Hamming distance","","43","1","21","IEEE","11 Nov 2010","","","IEEE","IEEE Conferences"
